Index,Species,Type1,Type2,Ability1,Ability2,Ability3,level,base_experience,HP,Attack,Defence,Sp.Attack,Sp.Defence,Speed,Total,Weight,Height,Seed Type,Egg Type1,Egg Type2,Moves
1,Bulbasaur,Grass,Poison,Overgrow,NULL,Chlorophyll,50,64,45,49,49,65,65,45,318,15.2 lbs.,"2'04""",Seed Pokémon,Monster,Grass,"razor-wind, swords-dance, cut, bind, vine-whip, headbutt, tackle, body-slam, take-down, double-edge, growl, strength, mega-drain, leech-seed, growth, razor-leaf, solar-beam, poison-powder, sleep-powder, petal-dance, string-shot, toxic, rage, mimic, double-team, defense-curl, light-screen, reflect, bide, sludge, skull-bash, amnesia, flash, rest, substitute, snore, curse, protect, sludge-bomb, mud-slap, outrage, giga-drain, endure, charm, false-swipe, swagger, fury-cutter, attract, sleep-talk, return, frustration, safeguard, sweet-scent, synthesis, hidden-power, sunny-day, rock-smash, facade, nature-power, helping-hand, ingrain, knock-off, secret-power, weather-ball, grass-whistle, bullet-seed, magical-leaf, natural-gift, worry-seed, seed-bomb, energy-ball, leaf-storm, power-whip, captivate, grass-knot, venoshock, acid-spray, round, echoed-voice, grass-pledge, work-up, grassy-terrain, confide, grassy-glide, tera-blast, trailblaze"
2,Ivysaur,Grass,Poison,Overgrow,NULL,Chlorophyll,50,142,60,62,63,80,80,60,405,28.7 lbs.,"3'03""",Seed Pokémon,Monster,Grass,"swords-dance, cut, bind, vine-whip, headbutt, tackle, body-slam, take-down, double-edge, growl, roar, strength, mega-drain, leech-seed, growth, razor-leaf, solar-beam, poison-powder, sleep-powder, petal-dance, string-shot, toxic, rage, mimic, double-team, defense-curl, light-screen, reflect, bide, amnesia, flash, rest, substitute, snore, curse, protect, sludge-bomb, mud-slap, outrage, giga-drain, endure, charm, false-swipe, swagger, fury-cutter, attract, sleep-talk, return, frustration, safeguard, sweet-scent, synthesis, hidden-power, sunny-day, rock-smash, facade, nature-power, helping-hand, ingrain, knock-off, secret-power, weather-ball, bullet-seed, magical-leaf, natural-gift, worry-seed, seed-bomb, energy-ball, leaf-storm, power-whip, captivate, grass-knot, venoshock, acid-spray, round, echoed-voice, grass-pledge, work-up, grassy-terrain, confide, grassy-glide, tera-blast, trailblaze"
3,Venusaur,Grass,Poison,Overgrow,NULL,Chlorophyll,50,263,80,82,83,100,100,80,525,220.5 lbs.,"6'07""",Seed Pokémon,Monster,Grass,"swords-dance, cut, bind, vine-whip, headbutt, tackle, body-slam, take-down, double-edge, growl, roar, hyper-beam, strength, mega-drain, leech-seed, growth, razor-leaf, solar-beam, poison-powder, sleep-powder, petal-dance, string-shot, earthquake, toxic, rage, mimic, double-team, defense-curl, light-screen, reflect, bide, amnesia, flash, rest, substitute, snore, curse, protect, scary-face, sludge-bomb, mud-slap, outrage, giga-drain, endure, charm, false-swipe, swagger, fury-cutter, attract, sleep-talk, return, frustration, safeguard, sweet-scent, synthesis, hidden-power, sunny-day, rock-smash, facade, nature-power, helping-hand, ingrain, knock-off, secret-power, weather-ball, bullet-seed, block, frenzy-plant, magical-leaf, natural-gift, worry-seed, poison-jab, seed-bomb, energy-ball, earth-power, giga-impact, rock-climb, leaf-storm, power-whip, captivate, grass-knot, venoshock, acid-spray, round, echoed-voice, grass-pledge, bulldoze, work-up, petal-blizzard, grassy-terrain, confide, stomping-tantrum, grassy-glide, terrain-pulse, tera-blast, trailblaze"
4,Charmander,Fire,NULL,Blaze,NULL,Solar Power,50,62,39,52,43,60,50,65,309,18.7 lbs.,"2'00""",Lizard Pokémon,Monster,Dragon,"mega-punch, fire-punch, thunder-punch, scratch, swords-dance, cut, wing-attack, mega-kick, headbutt, body-slam, take-down, double-edge, leer, bite, growl, roar, ember, flamethrower, submission, counter, seismic-toss, strength, dragon-rage, fire-spin, dig, toxic, rage, mimic, double-team, smokescreen, defense-curl, reflect, bide, fire-blast, swift, skull-bash, fury-swipes, rest, rock-slide, slash, substitute, snore, curse, protect, scary-face, belly-drum, mud-slap, outrage, endure, false-swipe, swagger, fury-cutter, attract, sleep-talk, return, frustration, dynamic-punch, dragon-breath, iron-tail, metal-claw, hidden-power, sunny-day, crunch, ancient-power, rock-smash, beat-up, heat-wave, will-o-wisp, facade, focus-punch, helping-hand, brick-break, secret-power, weather-ball, air-cutter, overheat, rock-tomb, aerial-ace, dragon-claw, dragon-dance, natural-gift, fling, flare-blitz, dragon-pulse, dragon-rush, focus-blast, shadow-claw, fire-fang, captivate, hone-claws, flame-burst, flame-charge, round, echoed-voice, incinerate, acrobatics, inferno, fire-pledge, dragon-tail, work-up, confide, power-up-punch, breaking-swipe, tera-blast, temper-flare"
5,Charmeleon,Fire,NULL,Blaze,NULL,Solar Power,50,142,58,64,58,80,65,80,405,41.9 lbs.,"3'07""",Flame Pokémon,Monster,Dragon,"mega-punch, fire-punch, thunder-punch, scratch, swords-dance, cut, mega-kick, headbutt, body-slam, take-down, double-edge, leer, bite, growl, roar, ember, flamethrower, submission, counter, seismic-toss, strength, dragon-rage, fire-spin, dig, toxic, rage, mimic, double-team, smokescreen, defense-curl, reflect, bide, fire-blast, swift, skull-bash, fury-swipes, rest, rock-slide, slash, substitute, snore, curse, protect, scary-face, belly-drum, mud-slap, outrage, endure, false-swipe, swagger, fury-cutter, attract, sleep-talk, return, frustration, dynamic-punch, dragon-breath, iron-tail, metal-claw, hidden-power, sunny-day, crunch, ancient-power, rock-smash, beat-up, heat-wave, will-o-wisp, facade, focus-punch, helping-hand, brick-break, secret-power, weather-ball, overheat, rock-tomb, aerial-ace, dragon-claw, dragon-dance, natural-gift, fling, flare-blitz, dragon-pulse, dragon-rush, focus-blast, shadow-claw, fire-fang, captivate, hone-claws, flame-burst, flame-charge, round, echoed-voice, incinerate, acrobatics, inferno, fire-pledge, dragon-tail, work-up, confide, power-up-punch, breaking-swipe, tera-blast, temper-flare"
6,Charizard,Fire,Flying,Blaze,NULL,Solar Power,50,267,78,84,78,109,85,100,534,199.5 lbs.,"5'07""",Flame Pokémon,Monster,Dragon,"mega-punch, fire-punch, thunder-punch, scratch, swords-dance, cut, wing-attack, fly, mega-kick, headbutt, body-slam, take-down, double-edge, leer, bite, growl, roar, ember, flamethrower, hyper-beam, submission, counter, seismic-toss, strength, solar-beam, dragon-rage, fire-spin, earthquake, fissure, dig, toxic, rage, mimic, double-team, smokescreen, defense-curl, reflect, bide, fire-blast, swift, skull-bash, fury-swipes, rest, rock-slide, slash, substitute, snore, curse, protect, scary-face, belly-drum, mud-slap, outrage, sandstorm, endure, false-swipe, swagger, fury-cutter, steel-wing, attract, sleep-talk, return, frustration, dynamic-punch, dragon-breath, iron-tail, metal-claw, hidden-power, twister, sunny-day, crunch, ancient-power, rock-smash, beat-up, heat-wave, will-o-wisp, facade, focus-punch, helping-hand, brick-break, secret-power, blaze-kick, blast-burn, weather-ball, air-cutter, overheat, rock-tomb, aerial-ace, dragon-claw, dragon-dance, roost, natural-gift, tailwind, fling, flare-blitz, air-slash, dragon-pulse, dragon-rush, focus-blast, giga-impact, shadow-claw, fire-fang, defog, captivate, ominous-wind, hone-claws, flame-burst, flame-charge, round, echoed-voice, sky-drop, incinerate, acrobatics, inferno, fire-pledge, bulldoze, dragon-tail, work-up, heat-crash, hurricane, confide, mystical-fire, power-up-punch, brutal-swing, breaking-swipe, scale-shot, dual-wingbeat, scorching-sands, tera-blast, dragon-cheer, temper-flare"
7,Squirtle,Water,NULL,Torrent,NULL,Rain Dish,50,63,44,48,65,50,64,43,314,19.8 lbs.,"1'08""",Tiny Turtle Pokémon,Monster,Water 1,"mega-punch, ice-punch, mega-kick, headbutt, tackle, body-slam, take-down, double-edge, tail-whip, bite, mist, water-gun, hydro-pump, surf, ice-beam, blizzard, bubble-beam, submission, counter, seismic-toss, strength, dig, toxic, confusion, rage, mimic, double-team, withdraw, defense-curl, haze, reflect, bide, waterfall, skull-bash, bubble, rest, rock-slide, substitute, snore, curse, flail, protect, mud-slap, foresight, icy-wind, outrage, endure, rollout, false-swipe, swagger, attract, sleep-talk, return, frustration, dynamic-punch, rapid-spin, iron-tail, hidden-power, rain-dance, mirror-coat, rock-smash, whirlpool, fake-out, hail, facade, focus-punch, follow-me, helping-hand, brick-break, yawn, refresh, secret-power, dive, mud-sport, weather-ball, rock-tomb, water-spout, muddy-water, iron-defense, mud-shot, water-pulse, gyro-ball, brine, natural-gift, fling, aqua-ring, aura-sphere, aqua-tail, dragon-pulse, zen-headbutt, captivate, aqua-jet, round, scald, shell-smash, water-pledge, work-up, confide, power-up-punch, liquidation, life-dew, flip-turn, wave-crash, tera-blast, ice-spinner, chilling-water"
8,Wartortle,Water,NULL,Torrent,NULL,Rain Dish,50,142,59,63,80,65,80,58,405,49.6 lbs.,"3'03""",Turtle Pokémon,Monster,Water 1,"mega-punch, ice-punch, mega-kick, headbutt, tackle, body-slam, take-down, double-edge, tail-whip, bite, mist, water-gun, hydro-pump, surf, ice-beam, blizzard, bubble-beam, submission, counter, seismic-toss, strength, dig, toxic, rage, mimic, double-team, withdraw, defense-curl, haze, reflect, bide, waterfall, skull-bash, bubble, rest, rock-slide, substitute, snore, curse, flail, protect, mud-slap, icy-wind, outrage, endure, rollout, false-swipe, swagger, attract, sleep-talk, return, frustration, dynamic-punch, rapid-spin, iron-tail, hidden-power, rain-dance, mirror-coat, rock-smash, whirlpool, fake-out, hail, facade, focus-punch, helping-hand, brick-break, yawn, secret-power, dive, weather-ball, rock-tomb, water-spout, muddy-water, iron-defense, mud-shot, water-pulse, gyro-ball, brine, natural-gift, fling, aqua-ring, aura-sphere, aqua-tail, dragon-pulse, zen-headbutt, captivate, aqua-jet, round, scald, shell-smash, water-pledge, work-up, confide, power-up-punch, liquidation, life-dew, flip-turn, wave-crash, tera-blast, ice-spinner, chilling-water"
9,Blastoise,Water,NULL,Torrent,NULL,Rain Dish,50,265,79,83,100,85,105,78,530,188.5 lbs.,"5'03""",Shellfish Pokémon,Monster,Water 1,"mega-punch, ice-punch, mega-kick, headbutt, tackle, body-slam, take-down, double-edge, tail-whip, bite, roar, mist, water-gun, hydro-pump, surf, ice-beam, blizzard, bubble-beam, hyper-beam, submission, counter, seismic-toss, strength, earthquake, fissure, dig, toxic, rage, mimic, double-team, withdraw, defense-curl, haze, reflect, bide, waterfall, skull-bash, bubble, rest, rock-slide, substitute, snore, curse, flail, protect, scary-face, mud-slap, icy-wind, outrage, endure, rollout, false-swipe, swagger, attract, sleep-talk, return, frustration, dynamic-punch, rapid-spin, iron-tail, hidden-power, rain-dance, crunch, mirror-coat, rock-smash, whirlpool, fake-out, hail, facade, focus-punch, helping-hand, brick-break, yawn, secret-power, dive, hydro-cannon, weather-ball, rock-tomb, water-spout, signal-beam, muddy-water, iron-defense, mud-shot, water-pulse, gyro-ball, brine, natural-gift, fling, aqua-ring, aura-sphere, dark-pulse, aqua-tail, dragon-pulse, focus-blast, giga-impact, avalanche, zen-headbutt, flash-cannon, rock-climb, captivate, aqua-jet, smack-down, round, scald, shell-smash, water-pledge, bulldoze, dragon-tail, work-up, confide, power-up-punch, liquidation, body-press, life-dew, terrain-pulse, flip-turn, wave-crash, tera-blast, ice-spinner, chilling-water"
10,Caterpie,Bug,NULL,Shield Dust,NULL,Run Away,50,39,45,30,35,20,20,45,195,6.4 lbs.,"1'00""",Worm Pokémon,Bug,NULL,"tackle, string-shot, snore, bug-bite, electroweb"
11,Metapod,Bug,NULL,Shed Skin,NULL,NULL,50,72,50,20,55,25,25,30,205,21.8 lbs.,"2'04""",Cocoon Pokémon,Bug,NULL,"string-shot, harden, iron-defense, bug-bite, electroweb"
12,Butterfree,Bug,Flying,Compound Eyes,NULL,Tinted Lens,50,198,60,45,50,90,80,70,395,70.5 lbs.,"3'07""",Butterfly Pokémon,Bug,NULL,"razor-wind, gust, whirlwind, headbutt, tackle, take-down, double-edge, supersonic, psybeam, hyper-beam, mega-drain, solar-beam, poison-powder, stun-spore, sleep-powder, string-shot, toxic, confusion, psychic, rage, teleport, mimic, double-team, harden, reflect, bide, swift, dream-eater, flash, psywave, rest, substitute, thief, nightmare, snore, curse, protect, giga-drain, endure, swagger, attract, sleep-talk, return, frustration, safeguard, baton-pass, sweet-scent, hidden-power, twister, rain-dance, sunny-day, psych-up, shadow-ball, facade, skill-swap, secret-power, air-cutter, silver-wind, signal-beam, aerial-ace, iron-defense, roost, natural-gift, tailwind, u-turn, air-slash, bug-buzz, energy-ball, giga-impact, defog, captivate, bug-bite, ominous-wind, venoshock, rage-powder, quiver-dance, round, acrobatics, struggle-bug, electroweb, hurricane, draining-kiss, confide, infestation, pollen-puff, dual-wingbeat"
13,Weedle,Bug,Poison,Shield Dust,NULL,Run Away,50,39,40,35,30,20,20,50,195,7.1 lbs.,"1'00""",Hairy Bug Pokémon,Bug,NULL,"poison-sting, string-shot, bug-bite, electroweb"
14,Kakuna,Bug,Poison,Shed Skin,Shed Skin,NULL,50,72,45,25,50,25,25,35,205,22.0 lbs.,"2'00""",Cocoon Pokémon,Bug,NULL,"string-shot, harden, iron-defense, bug-bite, electroweb"
15,Beedrill,Bug,Poison,Swarm,Swarm,Sniper,50,178,65,90,40,45,80,75,395,65.0 lbs.,"3'03""",Poison Bee Pokémon,Bug,NULL,"swords-dance, cut, headbutt, fury-attack, take-down, double-edge, poison-sting, twineedle, pin-missile, hyper-beam, peck, mega-drain, solar-beam, string-shot, toxic, agility, rage, mimic, double-team, harden, reflect, focus-energy, bide, swift, skull-bash, flash, rest, substitute, thief, snore, curse, protect, sludge-bomb, outrage, giga-drain, endure, false-swipe, swagger, fury-cutter, attract, sleep-talk, return, frustration, pursuit, sweet-scent, hidden-power, sunny-day, rock-smash, facade, brick-break, knock-off, endeavor, secret-power, air-cutter, silver-wind, aerial-ace, roost, natural-gift, tailwind, u-turn, payback, assurance, toxic-spikes, poison-jab, x-scissor, giga-impact, defog, captivate, bug-bite, ominous-wind, venoshock, round, acrobatics, struggle-bug, electroweb, drill-run, fell-stinger, confide, infestation, laser-focus, throat-chop, brutal-swing"
16,Pidgey,Normal,Flying,Keen Eye,Tangled Feet,Big Pecks,50,50,40,45,40,35,35,56,251,4.0 lbs.,"1'00""",Tiny Bird Pokémon,Flying,NULL,"razor-wind, gust, wing-attack, whirlwind, fly, sand-attack, headbutt, tackle, take-down, double-edge, toxic, agility, quick-attack, rage, mimic, double-team, reflect, bide, mirror-move, swift, sky-attack, rest, substitute, thief, snore, curse, protect, feint-attack, mud-slap, foresight, detect, endure, swagger, steel-wing, attract, sleep-talk, return, frustration, pursuit, hidden-power, twister, rain-dance, sunny-day, uproar, heat-wave, facade, secret-power, feather-dance, air-cutter, aerial-ace, roost, natural-gift, pluck, tailwind, u-turn, air-slash, brave-bird, defog, captivate, ominous-wind, round, work-up, hurricane, confide"
17,Pidgeotto,Normal,Flying,Keen Eye,Tangled Feet,Big Pecks,50,122,63,60,55,50,50,71,349,66.1 lbs.,"3'07""",Bird Pokémon,Flying,NULL,"razor-wind, gust, wing-attack, whirlwind, fly, sand-attack, headbutt, tackle, take-down, double-edge, toxic, agility, quick-attack, rage, mimic, double-team, reflect, bide, mirror-move, swift, sky-attack, rest, substitute, thief, snore, curse, protect, mud-slap, detect, endure, swagger, steel-wing, attract, sleep-talk, return, frustration, hidden-power, twister, rain-dance, sunny-day, uproar, heat-wave, facade, secret-power, feather-dance, air-cutter, aerial-ace, roost, natural-gift, pluck, tailwind, u-turn, air-slash, defog, captivate, ominous-wind, round, work-up, hurricane, confide"
18,Pidgeot,Normal,Flying,Keen Eye,Tangled Feet,Big Pecks,50,216,83,80,75,70,70,101,479,87.1 lbs.,"4'11""",Bird Pokémon,Flying,NULL,"razor-wind, gust, wing-attack, whirlwind, fly, sand-attack, headbutt, tackle, take-down, double-edge, hyper-beam, toxic, agility, quick-attack, rage, mimic, double-team, reflect, bide, mirror-move, swift, sky-attack, rest, substitute, thief, snore, curse, protect, mud-slap, detect, endure, swagger, steel-wing, attract, sleep-talk, return, frustration, hidden-power, twister, rain-dance, sunny-day, uproar, heat-wave, facade, secret-power, feather-dance, air-cutter, aerial-ace, roost, natural-gift, pluck, tailwind, u-turn, air-slash, giga-impact, defog, captivate, ominous-wind, round, work-up, hurricane, confide, laser-focus"
19,Rattata,Normal,NULL,Run Away,Guts,Hustle,50,51,30,56,35,25,35,72,253,7.7 lbs.,"1'00""",Mouse Pokémon,Field,NULL,"cut, headbutt, tackle, body-slam, take-down, double-edge, tail-whip, bite, water-gun, ice-beam, blizzard, bubble-beam, counter, thunderbolt, thunder-wave, thunder, dig, toxic, quick-attack, rage, mimic, screech, double-team, defense-curl, focus-energy, bide, swift, skull-bash, fury-swipes, rest, hyper-fang, super-fang, substitute, thief, flame-wheel, snore, curse, reversal, protect, sludge-bomb, mud-slap, icy-wind, endure, swagger, attract, sleep-talk, return, frustration, pursuit, iron-tail, hidden-power, rain-dance, sunny-day, crunch, shadow-ball, rock-smash, uproar, facade, taunt, revenge, endeavor, secret-power, covet, shock-wave, natural-gift, pluck, u-turn, assurance, me-first, last-resort, sucker-punch, zen-headbutt, captivate, grass-knot, charge-beam, round, retaliate, final-gambit, work-up, wild-charge, confide, laser-focus"
20,Raticate,Normal,NULL,Run Away,Guts,Hustle,50,145,55,81,60,50,70,97,413,40.8 lbs.,"2'04""",Mouse Pokémon,Field,NULL,"swords-dance, cut, headbutt, tackle, body-slam, take-down, double-edge, tail-whip, bite, roar, water-gun, ice-beam, blizzard, bubble-beam, hyper-beam, counter, strength, thunderbolt, thunder-wave, thunder, dig, toxic, quick-attack, rage, mimic, double-team, defense-curl, focus-energy, bide, swift, skull-bash, fury-swipes, rest, hyper-fang, super-fang, substitute, thief, snore, curse, protect, scary-face, sludge-bomb, mud-slap, icy-wind, endure, swagger, attract, sleep-talk, return, frustration, pursuit, iron-tail, hidden-power, rain-dance, sunny-day, crunch, shadow-ball, rock-smash, uproar, facade, taunt, endeavor, secret-power, covet, shock-wave, natural-gift, pluck, u-turn, assurance, last-resort, sucker-punch, giga-impact, zen-headbutt, captivate, grass-knot, charge-beam, round, retaliate, work-up, wild-charge, confide, laser-focus, throat-chop, stomping-tantrum"
21,Spearow,Normal,Flying,Keen Eye,Keen Eye,Sniper,50,52,40,60,30,31,31,70,262,4.4 lbs.,"1'00""",Tiny Bird Pokémon,Flying,NULL,"razor-wind, wing-attack, whirlwind, fly, headbutt, fury-attack, take-down, double-edge, leer, growl, peck, drill-peck, toxic, agility, quick-attack, rage, mimic, double-team, focus-energy, bide, mirror-move, swift, sky-attack, rest, tri-attack, substitute, thief, snore, curse, protect, scary-face, feint-attack, mud-slap, detect, endure, false-swipe, swagger, steel-wing, attract, sleep-talk, return, frustration, pursuit, hidden-power, twister, rain-dance, sunny-day, uproar, heat-wave, facade, secret-power, feather-dance, astonish, air-cutter, aerial-ace, roost, natural-gift, pluck, tailwind, u-turn, assurance, defog, captivate, ominous-wind, round, echoed-voice, work-up, drill-run, confide"
22,Fearow,Normal,Flying,Keen Eye,Keen Eye,Sniper,50,155,65,90,65,61,61,100,442,83.8 lbs.,"3'11""",Beak Pokémon,Flying,NULL,"razor-wind, wing-attack, whirlwind, fly, headbutt, fury-attack, take-down, double-edge, leer, growl, hyper-beam, peck, drill-peck, toxic, agility, quick-attack, rage, mimic, double-team, focus-energy, bide, mirror-move, swift, sky-attack, rest, tri-attack, substitute, thief, snore, curse, protect, mud-slap, detect, endure, false-swipe, swagger, steel-wing, attract, sleep-talk, return, frustration, pursuit, hidden-power, twister, rain-dance, sunny-day, uproar, heat-wave, facade, secret-power, air-cutter, aerial-ace, roost, natural-gift, pluck, tailwind, u-turn, assurance, giga-impact, defog, captivate, ominous-wind, round, echoed-voice, work-up, drill-run, confide, laser-focus, throat-chop"
23,Ekans,Poison,NULL,Intimidate,Shed Skin,Unnerve,50,58,35,60,44,40,54,55,288,15.2 lbs.,"6'07""",Snake Pokémon,Field,Dragon,"bind, slam, headbutt, body-slam, wrap, take-down, double-edge, poison-sting, leer, bite, disable, acid, strength, mega-drain, earthquake, fissure, dig, toxic, rage, mimic, screech, double-team, haze, bide, skull-bash, glare, leech-life, rest, rock-slide, substitute, thief, snore, curse, spite, protect, scary-face, sludge-bomb, mud-slap, giga-drain, endure, swagger, attract, sleep-talk, return, frustration, pursuit, iron-tail, hidden-power, rain-dance, sunny-day, crunch, beat-up, stockpile, spit-up, swallow, torment, facade, knock-off, snatch, secret-power, poison-fang, rock-tomb, mud-shot, poison-tail, natural-gift, payback, gastro-acid, sucker-punch, toxic-spikes, poison-jab, dark-pulse, aqua-tail, seed-bomb, switcheroo, fire-fang, mud-bomb, gunk-shot, captivate, venoshock, sludge-wave, coil, acid-spray, round, bulldoze, snarl, belch, confide, infestation, brutal-swing, psychic-fangs, scale-shot, skitter-smack, lash-out, tera-blast, trailblaze"
24,Arbok,Poison,NULL,Intimidate,Shed Skin,Unnerve,50,157,60,95,69,65,79,80,448,143.3 lbs.,"11'06""",Cobra Pokémon,Field,Dragon,"bind, slam, headbutt, body-slam, wrap, take-down, double-edge, poison-sting, leer, bite, acid, hyper-beam, strength, mega-drain, earthquake, fissure, dig, toxic, rage, mimic, screech, double-team, haze, bide, skull-bash, glare, leech-life, rest, rock-slide, substitute, thief, snore, curse, spite, protect, scary-face, sludge-bomb, mud-slap, giga-drain, endure, swagger, attract, sleep-talk, return, frustration, pain-split, iron-tail, hidden-power, rain-dance, sunny-day, crunch, stockpile, spit-up, swallow, torment, facade, knock-off, snatch, secret-power, poison-fang, rock-tomb, mud-shot, poison-tail, natural-gift, payback, gastro-acid, sucker-punch, toxic-spikes, poison-jab, dark-pulse, aqua-tail, seed-bomb, switcheroo, giga-impact, thunder-fang, ice-fang, fire-fang, mud-bomb, gunk-shot, captivate, venoshock, sludge-wave, coil, acid-spray, round, bulldoze, dragon-tail, snarl, belch, confide, infestation, throat-chop, brutal-swing, psychic-fangs, stomping-tantrum, breaking-swipe, scale-shot, skitter-smack, lash-out, tera-blast, trailblaze"
25,Pikachu,Electric,NULL,Static,Static,Lightning Rod,50,112,35,55,40,50,50,90,320,13.2 lbs.,"1'04""",Mouse Pokémon,Field,Fairy,"mega-punch, pay-day, thunder-punch, slam, double-kick, mega-kick, headbutt, body-slam, take-down, double-edge, tail-whip, growl, surf, submission, counter, seismic-toss, strength, thunder-shock, thunderbolt, thunder-wave, thunder, dig, toxic, agility, quick-attack, rage, mimic, double-team, defense-curl, light-screen, reflect, bide, swift, skull-bash, flash, rest, substitute, thief, snore, curse, reversal, protect, sweet-kiss, mud-slap, zap-cannon, detect, endure, charm, rollout, swagger, spark, attract, sleep-talk, return, frustration, dynamic-punch, encore, iron-tail, hidden-power, rain-dance, rock-smash, uproar, facade, focus-punch, charge, helping-hand, brick-break, knock-off, endeavor, secret-power, fake-tears, signal-beam, covet, volt-tackle, calm-mind, shock-wave, natural-gift, feint, fling, magnet-rise, nasty-plot, discharge, captivate, grass-knot, charge-beam, electro-ball, round, echoed-voice, volt-switch, electroweb, wild-charge, disarming-voice, draining-kiss, play-rough, play-nice, confide, eerie-impulse, electric-terrain, nuzzle, laser-focus, rising-voltage, tera-blast, trailblaze, alluring-voice, upper-hand"
26,Raichu,Electric,NULL,Static,Static,Lightning Rod,50,243,60,90,55,90,80,110,485,66.1 lbs.,"2'07""",Mouse Pokémon,Field,Fairy,"mega-punch, pay-day, thunder-punch, slam, mega-kick, headbutt, body-slam, take-down, double-edge, tail-whip, growl, surf, hyper-beam, submission, counter, seismic-toss, strength, thunder-shock, thunderbolt, thunder-wave, thunder, dig, toxic, agility, quick-attack, rage, mimic, double-team, defense-curl, light-screen, reflect, bide, swift, skull-bash, flash, rest, substitute, thief, snore, curse, reversal, protect, sweet-kiss, mud-slap, zap-cannon, detect, endure, charm, rollout, swagger, spark, attract, sleep-talk, return, frustration, safeguard, dynamic-punch, encore, iron-tail, hidden-power, rain-dance, rock-smash, fake-out, uproar, facade, focus-punch, charge, helping-hand, brick-break, knock-off, endeavor, secret-power, signal-beam, covet, calm-mind, shock-wave, natural-gift, feint, fling, magnet-rise, focus-blast, giga-impact, nasty-plot, discharge, captivate, grass-knot, charge-beam, electro-ball, round, echoed-voice, volt-switch, electroweb, wild-charge, disarming-voice, draining-kiss, play-rough, play-nice, confide, eerie-impulse, electric-terrain, nuzzle, laser-focus, speed-swap, brutal-swing, rising-voltage, tera-blast, trailblaze, alluring-voice, upper-hand"
