Index,Species,Type1,Type2,Ability1,Ability2,Ability3,level,base_experience,HP,Attack,Defence,Sp.Attack,Sp.Defence,Speed,Total,Weight,Height,Seed Type,Egg Type1,Egg Type2,Moves
546,Cottonee,Grass,Fairy,Prankster,Infiltrator,Chlorophyll,50,56,40,27,60,37,50,66,280,1.3 lbs.,"1'00""",Cotton Puff Pokémon,Grass,Fairy,"absorb, mega-drain, leech-seed, growth, razor-leaf, solar-beam, poison-powder, stun-spore, toxic, double-team, swift, dream-eater, flash, rest, substitute, snore, cotton-spore, protect, giga-drain, endure, charm, swagger, attract, sleep-talk, return, frustration, safeguard, encore, hidden-power, sunny-day, beat-up, memento, facade, nature-power, taunt, helping-hand, knock-off, endeavor, secret-power, fake-tears, grass-whistle, tickle, covet, natural-gift, tailwind, worry-seed, seed-bomb, energy-ball, switcheroo, defog, captivate, grass-knot, round, cotton-guard, grassy-terrain, misty-terrain, fairy-wind, confide, dazzling-gleam, grassy-glide, tera-blast"
547,Whimsicott,Grass,Fairy,Prankster,Infiltrator,Chlorophyll,50,168,60,67,85,77,75,116,480,14.6 lbs.,"2'04""",Windveiled Pokémon,Grass,Fairy,"gust, hyper-beam, absorb, mega-drain, leech-seed, growth, razor-leaf, solar-beam, poison-powder, stun-spore, toxic, psychic, double-team, light-screen, swift, dream-eater, flash, rest, substitute, thief, snore, cotton-spore, protect, giga-drain, endure, charm, swagger, attract, sleep-talk, return, frustration, safeguard, encore, hidden-power, sunny-day, shadow-ball, beat-up, memento, facade, nature-power, taunt, helping-hand, knock-off, endeavor, secret-power, fake-tears, tickle, covet, tailwind, u-turn, fling, worry-seed, seed-bomb, energy-ball, switcheroo, giga-impact, defog, trick-room, grass-knot, round, cotton-guard, hurricane, grassy-terrain, misty-terrain, play-rough, fairy-wind, moonblast, confide, dazzling-gleam, grassy-glide, tera-blast"
548,Petilil,Grass,NULL,Chlorophyll,Own Tempo,Leaf Guard,50,56,45,35,50,70,50,30,280,14.6 lbs.,"1'08""",Bulb Pokémon,Grass,NULL,"cut, absorb, mega-drain, leech-seed, growth, solar-beam, poison-powder, stun-spore, sleep-powder, toxic, double-team, recover, bide, dream-eater, flash, rest, substitute, snore, protect, giga-drain, endure, charm, swagger, attract, sleep-talk, heal-bell, return, frustration, safeguard, encore, sweet-scent, synthesis, hidden-power, sunny-day, facade, nature-power, helping-hand, ingrain, secret-power, aromatherapy, grass-whistle, bullet-seed, covet, magical-leaf, healing-wish, natural-gift, worry-seed, seed-bomb, energy-ball, leaf-storm, grass-knot, entrainment, after-you, round, confide, leafage, laser-focus, pollen-puff, grassy-glide, tera-blast, trailblaze"
549,Lilligant,Grass,NULL,Chlorophyll,Own Tempo,Leaf Guard,50,168,70,60,75,110,75,90,480,35.9 lbs.,"3'07""",Flowering Pokémon,Grass,NULL,"swords-dance, cut, hyper-beam, absorb, mega-drain, leech-seed, growth, solar-beam, stun-spore, sleep-powder, petal-dance, toxic, double-team, light-screen, dream-eater, flash, rest, substitute, snore, protect, giga-drain, endure, charm, swagger, attract, sleep-talk, heal-bell, return, frustration, safeguard, encore, synthesis, hidden-power, sunny-day, psych-up, facade, nature-power, helping-hand, role-play, secret-power, teeter-dance, weather-ball, aromatherapy, bullet-seed, covet, magical-leaf, leaf-blade, worry-seed, seed-bomb, energy-ball, giga-impact, leaf-storm, grass-knot, quiver-dance, entrainment, after-you, round, petal-blizzard, grassy-terrain, confide, solar-blade, laser-focus, pollen-puff, grassy-glide, tera-blast, trailblaze, alluring-voice"
550,Basculin,Water,NULL,Reckless,Adaptability,Mold Breaker,50,161,70,92,65,80,55,98,460,39.7 lbs.,"3'03""",Hostile Pokémon,Water 2,NULL,N/A
551,Sandile,Ground,Dark,Intimidate,Moxie,Anger Point,50,58,50,72,35,35,35,65,292,33.5 lbs.,"2'04""",Desert Croc Pokémon,Field,NULL,"cut, sand-attack, body-slam, take-down, thrash, double-edge, leer, bite, roar, counter, earthquake, dig, toxic, rage, double-team, focus-energy, rest, rock-slide, substitute, thief, snore, curse, spite, protect, scary-face, sludge-bomb, mud-slap, sandstorm, endure, swagger, mean-look, attract, sleep-talk, return, frustration, pursuit, iron-tail, hidden-power, crunch, beat-up, uproar, torment, facade, taunt, helping-hand, brick-break, snatch, secret-power, rock-tomb, sand-tomb, mud-shot, payback, assurance, embargo, fling, me-first, dark-pulse, aqua-tail, earth-power, shadow-claw, thunder-fang, fire-fang, rock-climb, stone-edge, stealth-rock, grass-knot, hone-claws, foul-play, round, incinerate, retaliate, bulldoze, snarl, confide, power-trip, stomping-tantrum, skitter-smack, lash-out, scorching-sands, tera-blast"
552,Krokorok,Ground,Dark,Intimidate,Moxie,Anger Point,50,123,60,82,45,45,45,74,351,73.6 lbs.,"3'03""",Desert Croc Pokémon,Field,NULL,"mega-punch, cut, mega-kick, sand-attack, body-slam, take-down, thrash, double-edge, leer, bite, roar, low-kick, strength, earthquake, dig, toxic, rage, double-team, focus-energy, rest, rock-slide, substitute, thief, snore, curse, spite, protect, scary-face, sludge-bomb, mud-slap, sandstorm, endure, swagger, attract, sleep-talk, return, frustration, iron-tail, hidden-power, crunch, rock-smash, beat-up, uproar, torment, facade, focus-punch, taunt, helping-hand, revenge, brick-break, knock-off, endeavor, snatch, secret-power, rock-tomb, sand-tomb, aerial-ace, dragon-claw, mud-shot, payback, assurance, embargo, fling, dark-pulse, aqua-tail, earth-power, shadow-claw, thunder-fang, fire-fang, stone-edge, stealth-rock, grass-knot, hone-claws, low-sweep, foul-play, round, incinerate, retaliate, bulldoze, dragon-tail, snarl, confide, power-up-punch, power-trip, brutal-swing, stomping-tantrum, breaking-swipe, scale-shot, skitter-smack, lash-out, scorching-sands, tera-blast"
553,Krookodile,Ground,Dark,Intimidate,Moxie,Anger Point,50,260,95,117,80,65,70,92,519,212.3 lbs.,"4'11""",Intimidation Pokémon,Field,NULL,"mega-punch, cut, mega-kick, sand-attack, body-slam, take-down, thrash, double-edge, leer, bite, roar, hyper-beam, low-kick, strength, earthquake, dig, toxic, rage, double-team, focus-energy, rest, rock-slide, substitute, thief, snore, curse, spite, protect, scary-face, sludge-bomb, mud-slap, outrage, sandstorm, endure, swagger, attract, sleep-talk, return, frustration, iron-tail, hidden-power, crunch, rock-smash, beat-up, uproar, torment, facade, focus-punch, taunt, helping-hand, superpower, revenge, brick-break, knock-off, endeavor, snatch, secret-power, rock-tomb, sand-tomb, aerial-ace, block, dragon-claw, bulk-up, mud-shot, close-combat, payback, assurance, embargo, fling, dark-pulse, aqua-tail, dragon-pulse, focus-blast, earth-power, giga-impact, shadow-claw, thunder-fang, fire-fang, gunk-shot, stone-edge, stealth-rock, grass-knot, hone-claws, smack-down, low-sweep, foul-play, round, incinerate, retaliate, bulldoze, dragon-tail, snarl, confide, power-up-punch, darkest-lariat, high-horsepower, throat-chop, power-trip, brutal-swing, stomping-tantrum, breaking-swipe, scale-shot, skitter-smack, lash-out, scorching-sands, tera-blast"
554,Darumaka,Fire,NULL,Hustle,NULL,Inner Focus,50,63,70,90,45,15,45,50,315,82.7 lbs.,"2'00""",Zen Charm Pokémon,Field,NULL,"mega-punch, fire-punch, mega-kick, headbutt, tackle, take-down, thrash, bite, roar, ember, flamethrower, strength, solar-beam, fire-spin, dig, toxic, rage, double-team, focus-energy, fire-blast, rest, rock-slide, substitute, thief, flame-wheel, snore, protect, belly-drum, endure, rollout, swagger, attract, sleep-talk, return, frustration, encore, hidden-power, sunny-day, rock-smash, uproar, heat-wave, will-o-wisp, facade, focus-punch, taunt, superpower, brick-break, yawn, endeavor, snatch, secret-power, overheat, rock-tomb, extrasensory, hammer-arm, gyro-ball, u-turn, fling, flare-blitz, fire-fang, zen-headbutt, grass-knot, flame-charge, round, incinerate, work-up, confide, power-up-punch"
555,Darmanitan,Fire,NULL,Sheer Force,NULL,Zen Mode,35,168,105,140,55,30,55,95,480,204.8 lbs.,"4'03""",Blazing Pokémon,Field,NULL,N/A
556,Maractus,Grass,NULL,Water Absorb,Chlorophyll,Storm Drain,50,161,75,86,67,106,67,60,461,61.7 lbs.,"3'03""",Cactus Pokémon,Grass,NULL,"pin-missile, peck, absorb, mega-drain, leech-seed, growth, solar-beam, petal-dance, toxic, screech, double-team, rest, substitute, snore, cotton-spore, protect, spikes, giga-drain, endure, swagger, attract, sleep-talk, return, frustration, safeguard, sweet-scent, synthesis, hidden-power, rain-dance, sunny-day, uproar, facade, nature-power, helping-hand, ingrain, knock-off, endeavor, secret-power, needle-arm, hyper-voice, weather-ball, grass-whistle, bullet-seed, aerial-ace, bounce, acupressure, assurance, worry-seed, sucker-punch, poison-jab, seed-bomb, drain-punch, energy-ball, leaf-storm, grass-knot, wood-hammer, after-you, round, cotton-guard, petal-blizzard, grassy-terrain, confide, spiky-shield, throat-chop, grassy-glide"
557,Dwebble,Bug,Rock,Sturdy,Shell Armor,Weak Armor,50,65,50,65,85,35,35,55,325,32.0 lbs.,"1'00""",Rock Inn Pokémon,Bug,Mineral,"swords-dance, cut, sand-attack, counter, strength, solar-beam, earthquake, dig, toxic, double-team, withdraw, rest, rock-slide, slash, substitute, snore, curse, flail, protect, feint-attack, spikes, sandstorm, endure, swagger, fury-cutter, attract, sleep-talk, return, frustration, hidden-power, rock-smash, facade, nature-power, knock-off, secret-power, rock-tomb, sand-tomb, aerial-ace, iron-defense, block, rock-blast, rock-polish, poison-jab, night-slash, x-scissor, shadow-claw, rock-wrecker, stone-edge, stealth-rock, bug-bite, hone-claws, wide-guard, smack-down, round, shell-smash, struggle-bug, bulldoze, rototiller, confide, skitter-smack"
558,Crustle,Bug,Rock,Sturdy,Shell Armor,Weak Armor,50,170,70,105,125,65,75,45,485,440.9 lbs.,"4'07""",Stone Home Pokémon,Bug,Mineral,"swords-dance, cut, sand-attack, hyper-beam, strength, solar-beam, earthquake, dig, toxic, double-team, withdraw, rest, rock-slide, slash, substitute, snore, flail, protect, feint-attack, spikes, sandstorm, endure, swagger, fury-cutter, attract, sleep-talk, return, frustration, hidden-power, rock-smash, facade, nature-power, knock-off, secret-power, rock-tomb, sand-tomb, aerial-ace, iron-defense, block, rock-blast, rock-polish, poison-jab, x-scissor, giga-impact, shadow-claw, rock-wrecker, stone-edge, stealth-rock, bug-bite, hone-claws, smack-down, heavy-slam, round, shell-smash, struggle-bug, bulldoze, confide, solar-blade, stomping-tantrum, body-press, meteor-beam, skitter-smack"
559,Scraggy,Dark,Fighting,Shed Skin,Moxie,Intimidate,50,70,50,75,70,35,70,48,348,26.0 lbs.,"2'00""",Shedding Pokémon,Field,Dragon,"mega-punch, fire-punch, ice-punch, thunder-punch, mega-kick, sand-attack, headbutt, take-down, double-edge, leer, roar, low-kick, counter, strength, dig, toxic, double-team, amnesia, high-jump-kick, rest, rock-slide, super-fang, substitute, thief, snore, curse, spite, protect, scary-face, feint-attack, sludge-bomb, detect, endure, swagger, attract, sleep-talk, return, frustration, encore, iron-tail, hidden-power, rain-dance, sunny-day, crunch, rock-smash, beat-up, fake-out, uproar, torment, facade, focus-punch, taunt, helping-hand, revenge, brick-break, knock-off, endeavor, snatch, secret-power, fake-tears, rock-tomb, iron-defense, dragon-claw, bulk-up, dragon-dance, close-combat, payback, assurance, fling, poison-jab, dark-pulse, dragon-pulse, drain-punch, focus-blast, zen-headbutt, rock-climb, iron-head, stone-edge, grass-knot, head-smash, smack-down, low-sweep, acid-spray, foul-play, round, chip-away, quick-guard, incinerate, retaliate, dragon-tail, work-up, dual-chop, snarl, confide, power-up-punch, throat-chop, lash-out, coaching, tera-blast, trailblaze, upper-hand"
560,Scrafty,Dark,Fighting,Shed Skin,Moxie,Intimidate,50,171,65,90,115,45,115,58,488,66.1 lbs.,"3'07""",Hoodlum Pokémon,Field,Dragon,"mega-punch, fire-punch, ice-punch, thunder-punch, swords-dance, mega-kick, sand-attack, headbutt, body-slam, take-down, double-edge, leer, roar, hyper-beam, low-kick, counter, strength, dig, toxic, double-team, metronome, amnesia, high-jump-kick, rest, rock-slide, super-fang, substitute, thief, snore, curse, reversal, spite, protect, scary-face, feint-attack, sludge-bomb, detect, outrage, endure, swagger, attract, sleep-talk, return, frustration, encore, iron-tail, hidden-power, rain-dance, sunny-day, crunch, rock-smash, beat-up, fake-out, uproar, torment, facade, focus-punch, taunt, helping-hand, revenge, brick-break, knock-off, endeavor, snatch, secret-power, fake-tears, rock-tomb, iron-defense, dragon-claw, bulk-up, dragon-dance, close-combat, payback, assurance, fling, poison-jab, dark-pulse, dragon-pulse, drain-punch, focus-blast, giga-impact, zen-headbutt, rock-climb, iron-head, stone-edge, grass-knot, head-smash, smack-down, low-sweep, acid-spray, foul-play, round, chip-away, quick-guard, incinerate, retaliate, dragon-tail, work-up, dual-chop, snarl, confide, power-up-punch, throat-chop, lash-out, coaching, tera-blast, trailblaze, upper-hand"
561,Sigilyph,Psychic,Flying,Wonder Skin,Magic Guard,Tinted Lens,50,172,72,58,80,103,80,97,490,30.9 lbs.,"4'07""",Avianoid Pokémon,Flying,NULL,"gust, whirlwind, fly, ice-beam, psybeam, hyper-beam, solar-beam, thunder-wave, toxic, confusion, psychic, hypnosis, double-team, light-screen, reflect, mirror-move, swift, dream-eater, sky-attack, flash, psywave, rest, substitute, thief, snore, protect, icy-wind, endure, swagger, steel-wing, attract, sleep-talk, return, frustration, safeguard, hidden-power, rain-dance, psych-up, ancient-power, shadow-ball, future-sight, heat-wave, facade, trick, magic-coat, skill-swap, imprison, secret-power, air-cutter, cosmic-power, signal-beam, aerial-ace, calm-mind, shock-wave, roost, gravity, miracle-eye, pluck, tailwind, psycho-shift, power-swap, dark-pulse, air-slash, energy-ball, giga-impact, psycho-cut, zen-headbutt, flash-cannon, defog, trick-room, charge-beam, psyshock, telekinesis, magic-room, smack-down, synchronoise, round, stored-power, confide, dazzling-gleam, speed-swap, expanding-force, dual-wingbeat"
562,Yamask,Ghost,NULL,Mummy,NULL,NULL,50,61,38,30,85,55,65,30,303,3.3 lbs.,"1'08""",Spirit Pokémon,Mineral,Amorphous,"disable, toxic, psychic, night-shade, double-team, haze, dream-eater, flash, rest, substitute, thief, nightmare, snore, curse, spite, protect, destiny-bond, endure, swagger, mean-look, attract, sleep-talk, return, frustration, safeguard, pain-split, hidden-power, rain-dance, psych-up, shadow-ball, will-o-wisp, memento, facade, trick, role-play, magic-coat, knock-off, skill-swap, imprison, grudge, snatch, secret-power, astonish, fake-tears, iron-defense, block, calm-mind, shock-wave, payback, embargo, heal-block, toxic-spikes, dark-pulse, energy-ball, nasty-plot, zen-headbutt, trick-room, ominous-wind, guard-split, power-split, wonder-room, telekinesis, after-you, round, ally-switch, hex, crafty-shield, confide, infestation, poltergeist"
563,Cofagrigus,Ghost,NULL,Mummy,NULL,NULL,50,169,58,50,145,95,105,30,483,168.7 lbs.,"5'07""",Coffin Pokémon,Mineral,Amorphous,"disable, hyper-beam, toxic, psychic, night-shade, double-team, haze, dream-eater, flash, rest, substitute, thief, snore, curse, spite, protect, scary-face, destiny-bond, endure, swagger, mean-look, attract, sleep-talk, return, frustration, safeguard, pain-split, hidden-power, rain-dance, psych-up, shadow-ball, will-o-wisp, facade, trick, role-play, magic-coat, revenge, knock-off, skill-swap, imprison, grudge, snatch, secret-power, astonish, fake-tears, iron-defense, block, calm-mind, shock-wave, payback, embargo, power-swap, guard-swap, toxic-spikes, dark-pulse, energy-ball, giga-impact, nasty-plot, shadow-claw, zen-headbutt, trick-room, grass-knot, ominous-wind, guard-split, power-split, wonder-room, telekinesis, after-you, round, ally-switch, hex, phantom-force, crafty-shield, confide, infestation, body-press, poltergeist"
564,Tirtouga,Water,Rock,Solid Rock,Sturdy,Swift Swim,50,71,54,78,103,53,45,22,355,36.4 lbs.,"2'04""",Prototurtle Pokémon,Water 1,Water 3,"slam, body-slam, bite, water-gun, hydro-pump, surf, ice-beam, blizzard, strength, rock-throw, earthquake, dig, toxic, double-team, withdraw, bide, waterfall, rest, rock-slide, substitute, snore, curse, flail, protect, icy-wind, sandstorm, endure, rollout, swagger, attract, sleep-talk, return, frustration, iron-tail, hidden-power, rain-dance, crunch, ancient-power, rock-smash, whirlpool, facade, knock-off, secret-power, dive, rock-tomb, muddy-water, iron-defense, block, mud-shot, rock-blast, water-pulse, brine, guard-swap, rock-polish, aqua-tail, earth-power, zen-headbutt, stone-edge, stealth-rock, aqua-jet, wide-guard, smack-down, round, scald, shell-smash, bulldoze, confide, liquidation, meteor-beam"
565,Carracosta,Water,Rock,Solid Rock,Sturdy,Swift Swim,50,173,74,108,133,83,65,32,495,178.6 lbs.,"3'11""",Prototurtle Pokémon,Water 1,Water 3,"body-slam, bite, water-gun, hydro-pump, surf, ice-beam, blizzard, hyper-beam, low-kick, strength, earthquake, dig, toxic, double-team, withdraw, bide, waterfall, rest, rock-slide, substitute, snore, curse, protect, icy-wind, sandstorm, endure, rollout, swagger, attract, sleep-talk, return, frustration, iron-tail, hidden-power, rain-dance, crunch, ancient-power, rock-smash, whirlpool, facade, superpower, knock-off, secret-power, dive, rock-tomb, muddy-water, iron-defense, block, mud-shot, rock-blast, water-pulse, brine, guard-swap, rock-polish, aqua-tail, focus-blast, earth-power, giga-impact, zen-headbutt, iron-head, stone-edge, stealth-rock, aqua-jet, wide-guard, smack-down, round, scald, shell-smash, bulldoze, razor-shell, confide, liquidation, meteor-beam"
566,Archen,Rock,Flying,Defeatist,NULL,NULL,50,71,55,112,45,74,45,70,401,20.9 lbs.,"1'08""",First Bird Pokémon,Flying,Water 3,"cut, wing-attack, thrash, leer, bite, roar, rock-throw, earthquake, dig, toxic, agility, quick-attack, double-team, swift, rest, rock-slide, substitute, snore, protect, scary-face, sandstorm, endure, swagger, steel-wing, attract, sleep-talk, return, frustration, dragon-breath, iron-tail, hidden-power, crunch, ancient-power, rock-smash, uproar, heat-wave, torment, facade, taunt, knock-off, endeavor, secret-power, rock-tomb, aerial-ace, iron-defense, dragon-claw, bounce, rock-blast, roost, pluck, tailwind, u-turn, assurance, rock-polish, aqua-tail, dragon-pulse, earth-power, switcheroo, shadow-claw, zen-headbutt, defog, stone-edge, stealth-rock, head-smash, hone-claws, smack-down, round, quick-guard, ally-switch, acrobatics, bulldoze, confide, meteor-beam, lash-out, dual-wingbeat"
567,Archeops,Rock,Flying,Defeatist,NULL,NULL,50,177,75,140,65,112,65,110,567,70.5 lbs.,"4'07""",First Bird Pokémon,Flying,Water 3,"cut, wing-attack, fly, thrash, leer, roar, hyper-beam, rock-throw, earthquake, dig, toxic, agility, quick-attack, double-team, swift, sky-attack, rest, rock-slide, substitute, snore, protect, scary-face, outrage, sandstorm, endure, swagger, steel-wing, attract, sleep-talk, return, frustration, dragon-breath, iron-tail, hidden-power, crunch, ancient-power, rock-smash, uproar, heat-wave, torment, facade, taunt, knock-off, endeavor, secret-power, rock-tomb, aerial-ace, iron-defense, dragon-claw, bounce, rock-blast, roost, pluck, tailwind, u-turn, assurance, rock-polish, aqua-tail, air-slash, dragon-pulse, focus-blast, earth-power, giga-impact, shadow-claw, zen-headbutt, defog, stone-edge, stealth-rock, hone-claws, smack-down, round, quick-guard, ally-switch, acrobatics, bulldoze, dragon-tail, confide, meteor-beam, lash-out, dual-wingbeat"
568,Trubbish,Poison,NULL,Stench,Sticky Hold,Aftermath,50,66,50,50,62,40,62,65,329,68.3 lbs.,"2'00""",Trash Bag Pokémon,Mineral,NULL,"pound, double-slap, sand-attack, take-down, toxic, double-team, haze, self-destruct, sludge, amnesia, poison-gas, explosion, rest, substitute, thief, snore, curse, spite, protect, sludge-bomb, spikes, giga-drain, endure, rollout, swagger, attract, sleep-talk, return, frustration, pain-split, hidden-power, rain-dance, sunny-day, stockpile, swallow, facade, recycle, secret-power, mud-sport, rock-blast, payback, toxic-spikes, dark-pulse, seed-bomb, drain-punch, gunk-shot, venoshock, autotomize, sludge-wave, acid-spray, round, clear-smog, belch, confide, venom-drench, infestation, corrosive-gas"
569,Garbodor,Poison,NULL,Stench,Weak Armor,Aftermath,50,166,80,95,82,60,82,75,474,236.6 lbs.,"6'03""",Trash Heap Pokémon,Mineral,NULL,"pound, double-slap, body-slam, take-down, hyper-beam, solar-beam, thunderbolt, toxic, psychic, screech, double-team, self-destruct, sludge, amnesia, poison-gas, explosion, rest, substitute, thief, snore, spite, protect, sludge-bomb, spikes, giga-drain, endure, swagger, attract, sleep-talk, return, frustration, pain-split, metal-claw, hidden-power, rain-dance, sunny-day, stockpile, swallow, facade, recycle, secret-power, rock-blast, payback, fling, toxic-spikes, rock-polish, dark-pulse, seed-bomb, drain-punch, focus-blast, giga-impact, cross-poison, gunk-shot, venoshock, smack-down, sludge-wave, acid-spray, round, clear-smog, belch, confide, venom-drench, infestation, stomping-tantrum, body-press, corrosive-gas"
570,Zorua,Dark,NULL,Illusion,NULL,NULL,50,66,40,65,40,80,40,65,330,27.6 lbs.,"2'04""",Tricky Fox Pokémon,Field,NULL,"scratch, swords-dance, cut, take-down, leer, roar, counter, dig, toxic, agility, night-shade, double-team, confuse-ray, swift, fury-swipes, rest, substitute, thief, snore, spite, protect, scary-face, feint-attack, sludge-bomb, detect, endure, swagger, attract, sleep-talk, return, frustration, pain-split, encore, pursuit, hidden-power, rain-dance, sunny-day, psych-up, shadow-ball, uproar, torment, memento, facade, taunt, helping-hand, trick, revenge, knock-off, imprison, snatch, secret-power, hyper-voice, fake-tears, extrasensory, aerial-ace, bounce, covet, calm-mind, u-turn, payback, assurance, embargo, fling, copycat, punishment, sucker-punch, dark-pulse, nasty-plot, shadow-claw, captivate, grass-knot, hone-claws, foul-play, round, hex, incinerate, retaliate, night-daze, snarl, confide, skitter-smack, burning-jealousy, lash-out, tera-blast"
571,Zoroark,Dark,NULL,Illusion,NULL,NULL,50,179,60,105,60,120,60,105,510,178.8 lbs.,"5'03""",Illusion Fox Pokémon,Field,NULL,"mega-punch, scratch, swords-dance, cut, mega-kick, body-slam, take-down, leer, roar, flamethrower, hyper-beam, low-kick, dig, toxic, psychic, agility, night-shade, double-team, confuse-ray, swift, fury-swipes, rest, substitute, thief, snore, spite, protect, scary-face, feint-attack, sludge-bomb, endure, swagger, attract, sleep-talk, return, frustration, pain-split, encore, pursuit, hidden-power, rain-dance, sunny-day, crunch, psych-up, shadow-ball, rock-smash, uproar, torment, facade, taunt, helping-hand, trick, revenge, brick-break, knock-off, imprison, snatch, secret-power, hyper-voice, fake-tears, aerial-ace, bounce, covet, calm-mind, u-turn, payback, assurance, embargo, fling, punishment, dark-pulse, night-slash, focus-blast, giga-impact, nasty-plot, shadow-claw, grass-knot, hone-claws, low-sweep, foul-play, round, hex, incinerate, retaliate, night-daze, snarl, confide, laser-focus, throat-chop, skitter-smack, burning-jealousy, lash-out, tera-blast"
572,Minccino,Normal,NULL,Cute Charm,Technician,Skill Link,50,60,55,50,40,40,40,75,300,12.8 lbs.,"1'04""",Chinchilla Pokémon,Field,NULL,"pound, double-slap, slam, take-down, tail-whip, growl, sing, thunderbolt, thunder-wave, dig, toxic, double-team, swift, rest, super-fang, substitute, thief, snore, flail, protect, mud-slap, endure, charm, swagger, attract, sleep-talk, return, frustration, safeguard, baton-pass, encore, iron-tail, hidden-power, rain-dance, sunny-day, uproar, facade, helping-hand, knock-off, endeavor, secret-power, hyper-voice, fake-tears, tickle, bullet-seed, covet, calm-mind, shock-wave, wake-up-slap, u-turn, fling, last-resort, aqua-tail, seed-bomb, gunk-shot, captivate, grass-knot, after-you, round, echoed-voice, retaliate, work-up, tail-slap, play-rough, confide, dazzling-gleam, baby-doll-eyes, triple-axel, tera-blast, tidy-up, trailblaze, chilling-water, alluring-voice"
573,Cinccino,Normal,NULL,Cute Charm,Technician,Skill Link,50,165,75,95,60,65,60,115,470,16.5 lbs.,"1'08""",Scarf Pokémon,Field,NULL,"pound, slam, take-down, double-edge, tail-whip, sing, hyper-beam, thunderbolt, thunder-wave, thunder, dig, toxic, double-team, light-screen, swift, rest, super-fang, substitute, thief, snore, flail, protect, mud-slap, endure, charm, swagger, attract, sleep-talk, return, frustration, safeguard, baton-pass, encore, iron-tail, hidden-power, rain-dance, sunny-day, uproar, facade, helping-hand, knock-off, endeavor, secret-power, hyper-voice, fake-tears, tickle, bullet-seed, covet, calm-mind, rock-blast, shock-wave, u-turn, fling, last-resort, aqua-tail, seed-bomb, focus-blast, giga-impact, gunk-shot, grass-knot, after-you, round, echoed-voice, retaliate, work-up, tail-slap, play-rough, confide, dazzling-gleam, baby-doll-eyes, laser-focus, triple-axel, tera-blast, ice-spinner, tidy-up, trailblaze, chilling-water, alluring-voice"
