Index,Species,Type1,Type2,Ability1,Ability2,Ability3,level,base_experience,HP,Attack,Defence,Sp.Attack,Sp.Defence,Speed,Total,Weight,Height,Seed Type,Egg Type1,Egg Type2,Moves
181,Ampharos,Electric,NULL,Static,NULL,Plus,50,230,90,75,85,115,90,55,510,135.6 lbs.,"4'07""",Light Pokémon,Monster,Field,"mega-punch, fire-punch, ice-punch, thunder-punch, mega-kick, headbutt, tackle, body-slam, take-down, double-edge, growl, roar, hyper-beam, low-kick, counter, seismic-toss, strength, thunder-shock, thunderbolt, thunder-wave, thunder, dig, toxic, agility, mimic, double-team, confuse-ray, defense-curl, light-screen, reflect, swift, flash, rest, substitute, snore, curse, cotton-spore, protect, zap-cannon, outrage, endure, swagger, attract, sleep-talk, heal-bell, return, frustration, safeguard, dynamic-punch, iron-tail, hidden-power, rain-dance, sunny-day, rock-smash, facade, focus-punch, charge, helping-hand, brick-break, endeavor, secret-power, signal-beam, shock-wave, natural-gift, fling, magnet-rise, dragon-pulse, power-gem, focus-blast, giga-impact, rock-climb, discharge, captivate, charge-beam, electro-ball, after-you, round, echoed-voice, volt-switch, bulldoze, dragon-tail, electroweb, wild-charge, cotton-guard, ion-deluge, confide, eerie-impulse, magnetic-flux, electric-terrain, dazzling-gleam, power-up-punch, laser-focus, brutal-swing, stomping-tantrum, breaking-swipe, meteor-beam, tera-blast, trailblaze, dragon-cheer, supercell-slam"
182,Bellossom,Grass,NULL,Chlorophyll,NULL,Healer,50,245,75,80,95,90,100,50,490,12.8 lbs.,"1'04""",Flower Pokémon,Grass,NULL,"swords-dance, cut, double-edge, acid, hyper-beam, absorb, mega-drain, leech-seed, growth, razor-leaf, solar-beam, poison-powder, stun-spore, sleep-powder, petal-dance, toxic, mimic, double-team, flash, rest, substitute, snore, curse, flail, protect, sludge-bomb, giga-drain, endure, charm, swagger, attract, sleep-talk, return, frustration, safeguard, baton-pass, encore, sweet-scent, synthesis, moonlight, hidden-power, sunny-day, uproar, facade, nature-power, helping-hand, ingrain, endeavor, secret-power, teeter-dance, weather-ball, tickle, bullet-seed, magical-leaf, leaf-blade, natural-gift, fling, gastro-acid, worry-seed, seed-bomb, drain-punch, energy-ball, giga-impact, leaf-storm, captivate, grass-knot, venoshock, quiver-dance, acid-spray, after-you, round, petal-blizzard, grassy-terrain, play-rough, moonblast, confide, dazzling-gleam, infestation, strength-sap, solar-blade, laser-focus, pollen-puff, grassy-glide, triple-axel, tera-blast, trailblaze"
183,Marill,Water,Fairy,Thick Fat,Huge Power,Sap Sipper,50,88,70,20,50,20,50,40,250,18.7 lbs.,"1'04""",Aqua Mouse Pokémon,Water 1,Fairy,"mega-punch, ice-punch, slam, mega-kick, headbutt, tackle, body-slam, take-down, double-edge, tail-whip, sing, supersonic, water-gun, hydro-pump, surf, ice-beam, blizzard, bubble-beam, seismic-toss, strength, dig, toxic, mimic, double-team, defense-curl, light-screen, metronome, waterfall, swift, amnesia, bubble, splash, rest, substitute, snore, curse, protect, belly-drum, mud-slap, foresight, perish-song, icy-wind, endure, charm, rollout, swagger, attract, sleep-talk, return, present, frustration, dynamic-punch, encore, iron-tail, hidden-power, rain-dance, future-sight, rock-smash, whirlpool, uproar, hail, facade, focus-punch, helping-hand, superpower, brick-break, knock-off, refresh, secret-power, dive, camouflage, hyper-voice, fake-tears, tickle, muddy-water, bounce, mud-shot, covet, water-sport, water-pulse, natural-gift, fling, copycat, aqua-ring, aqua-tail, captivate, grass-knot, aqua-jet, soak, round, scald, bulldoze, work-up, disarming-voice, draining-kiss, misty-terrain, play-rough, confide, power-up-punch, brutal-swing, liquidation, steel-roller, misty-explosion, tera-blast, ice-spinner, snowscape, trailblaze, chilling-water, alluring-voice"
184,Azumarill,Water,Fairy,Thick Fat,Huge Power,Sap Sipper,50,210,100,50,80,60,80,50,420,62.8 lbs.,"2'07""",Aqua Rabbit Pokémon,Water 1,Fairy,"mega-punch, ice-punch, slam, mega-kick, headbutt, tackle, body-slam, take-down, double-edge, tail-whip, water-gun, hydro-pump, surf, ice-beam, blizzard, bubble-beam, hyper-beam, seismic-toss, strength, dig, toxic, mimic, double-team, defense-curl, light-screen, metronome, waterfall, swift, amnesia, bubble, splash, rest, substitute, snore, curse, protect, mud-slap, icy-wind, endure, charm, rollout, swagger, attract, sleep-talk, return, frustration, dynamic-punch, encore, iron-tail, hidden-power, rain-dance, future-sight, rock-smash, whirlpool, uproar, hail, facade, focus-punch, helping-hand, superpower, brick-break, knock-off, secret-power, dive, hyper-voice, fake-tears, muddy-water, bounce, mud-shot, covet, water-sport, water-pulse, natural-gift, fling, aqua-ring, aqua-tail, focus-blast, giga-impact, captivate, grass-knot, round, scald, bulldoze, work-up, disarming-voice, draining-kiss, misty-terrain, play-rough, confide, power-up-punch, brutal-swing, liquidation, steel-roller, misty-explosion, tera-blast, ice-spinner, snowscape, trailblaze, chilling-water, alluring-voice"
185,Sudowoodo,Rock,NULL,Sturdy,Rock Head,Rattled,50,144,70,100,115,30,65,30,410,83.8 lbs.,"3'11""",Imitation Pokémon,Mineral,NULL,"mega-punch, fire-punch, ice-punch, thunder-punch, slam, mega-kick, headbutt, tackle, body-slam, take-down, double-edge, hyper-beam, low-kick, counter, seismic-toss, strength, rock-throw, earthquake, dig, toxic, mimic, double-team, harden, defense-curl, self-destruct, explosion, rest, rock-slide, substitute, thief, snore, curse, flail, protect, feint-attack, mud-slap, spikes, sandstorm, endure, rollout, swagger, attract, sleep-talk, return, frustration, dynamic-punch, hidden-power, sunny-day, psych-up, rock-smash, uproar, torment, facade, focus-punch, nature-power, taunt, helping-hand, role-play, brick-break, endeavor, secret-power, fake-tears, rock-tomb, sand-tomb, iron-defense, block, mud-shot, covet, calm-mind, rock-blast, hammer-arm, natural-gift, fling, copycat, sucker-punch, rock-polish, power-gem, drain-punch, earth-power, giga-impact, stone-edge, captivate, stealth-rock, grass-knot, wood-hammer, head-smash, smack-down, low-sweep, foul-play, after-you, round, bulldoze, confide, power-up-punch, high-horsepower, stomping-tantrum, tearful-look, body-press, meteor-beam, tera-blast, trailblaze"
186,Politoed,Water,NULL,Water Absorb,Damp,Drizzle,50,250,90,75,75,90,100,70,500,74.7 lbs.,"3'07""",Frog Pokémon,Water 1,NULL,"pound, double-slap, mega-punch, ice-punch, mega-kick, headbutt, body-slam, take-down, double-edge, mist, water-gun, hydro-pump, surf, ice-beam, blizzard, bubble-beam, hyper-beam, low-kick, counter, seismic-toss, strength, earthquake, dig, toxic, psychic, hypnosis, mimic, screech, double-team, defense-curl, haze, metronome, waterfall, swift, amnesia, splash, rest, substitute, thief, snore, curse, protect, belly-drum, mud-slap, perish-song, icy-wind, detect, endure, swagger, attract, sleep-talk, return, frustration, dynamic-punch, encore, hidden-power, rain-dance, psych-up, rock-smash, whirlpool, uproar, hail, facade, focus-punch, helping-hand, brick-break, endeavor, secret-power, dive, hyper-voice, weather-ball, muddy-water, bounce, mud-shot, water-pulse, natural-gift, payback, fling, focus-blast, earth-power, giga-impact, captivate, low-sweep, round, echoed-voice, scald, bulldoze, confide, power-up-punch, liquidation, tera-blast, chilling-water"
187,Hoppip,Grass,Flying,Chlorophyll,Leaf Guard,Infiltrator,50,50,35,35,40,35,55,50,250,1.1 lbs.,"1'04""",Cottonweed Pokémon,Fairy,Grass,"pay-day, swords-dance, headbutt, tackle, take-down, double-edge, tail-whip, growl, absorb, mega-drain, leech-seed, solar-beam, poison-powder, stun-spore, sleep-powder, toxic, confusion, mimic, double-team, defense-curl, light-screen, reflect, amnesia, flash, splash, rest, substitute, thief, snore, curse, cotton-spore, protect, giga-drain, endure, charm, swagger, attract, sleep-talk, return, frustration, baton-pass, encore, sweet-scent, synthesis, hidden-power, rain-dance, sunny-day, psych-up, memento, facade, helping-hand, secret-power, aromatherapy, silver-wind, bullet-seed, aerial-ace, bounce, magical-leaf, natural-gift, tailwind, u-turn, fling, worry-seed, seed-bomb, energy-ball, switcheroo, leaf-storm, captivate, grass-knot, rage-powder, round, acrobatics, cotton-guard, grassy-terrain, fairy-wind, confide, dazzling-gleam, infestation, strength-sap, pollen-puff, lunge, tera-blast, trailblaze"
188,Skiploom,Grass,Flying,Chlorophyll,Leaf Guard,Infiltrator,50,119,55,45,50,45,65,80,340,2.2 lbs.,"2'00""",Cottonweed Pokémon,Fairy,Grass,"swords-dance, headbutt, tackle, take-down, double-edge, tail-whip, absorb, mega-drain, leech-seed, solar-beam, poison-powder, stun-spore, sleep-powder, toxic, mimic, double-team, defense-curl, light-screen, reflect, flash, splash, rest, substitute, thief, snore, curse, cotton-spore, protect, giga-drain, endure, charm, swagger, attract, sleep-talk, return, frustration, baton-pass, encore, sweet-scent, synthesis, hidden-power, sunny-day, psych-up, memento, facade, helping-hand, endeavor, secret-power, silver-wind, bullet-seed, aerial-ace, bounce, magical-leaf, natural-gift, tailwind, u-turn, fling, worry-seed, seed-bomb, energy-ball, leaf-storm, captivate, grass-knot, rage-powder, round, acrobatics, grassy-terrain, fairy-wind, confide, dazzling-gleam, infestation, pollen-puff, lunge, tera-blast, trailblaze"
189,Jumpluff,Grass,Flying,Chlorophyll,Leaf Guard,Infiltrator,50,207,75,55,70,55,95,110,460,6.6 lbs.,"2'07""",Cottonweed Pokémon,Fairy,Grass,"swords-dance, headbutt, tackle, take-down, double-edge, tail-whip, hyper-beam, absorb, mega-drain, leech-seed, solar-beam, poison-powder, stun-spore, sleep-powder, toxic, mimic, double-team, defense-curl, light-screen, reflect, flash, splash, rest, substitute, thief, snore, curse, cotton-spore, protect, giga-drain, endure, charm, swagger, attract, sleep-talk, return, frustration, baton-pass, encore, sweet-scent, synthesis, hidden-power, rain-dance, sunny-day, psych-up, memento, facade, helping-hand, endeavor, secret-power, silver-wind, bullet-seed, aerial-ace, bounce, magical-leaf, natural-gift, tailwind, u-turn, fling, worry-seed, seed-bomb, energy-ball, giga-impact, leaf-storm, captivate, grass-knot, rage-powder, round, acrobatics, grassy-terrain, fairy-wind, confide, dazzling-gleam, infestation, pollen-puff, lunge, tera-blast, trailblaze"
190,Aipom,Normal,NULL,Run Away,Pickup,Skill Link,50,72,55,70,55,40,55,85,360,25.4 lbs.,"2'07""",Long Tail Pokémon,Field,NULL,"double-slap, mega-punch, fire-punch, ice-punch, thunder-punch, scratch, cut, slam, mega-kick, sand-attack, headbutt, body-slam, take-down, double-edge, tail-whip, low-kick, counter, seismic-toss, strength, solar-beam, thunderbolt, thunder-wave, thunder, dig, toxic, agility, quick-attack, mimic, screech, double-team, defense-curl, metronome, swift, dream-eater, fury-swipes, rest, substitute, thief, nightmare, snore, curse, spite, protect, mud-slap, zap-cannon, detect, endure, swagger, fury-cutter, attract, sleep-talk, return, frustration, dynamic-punch, baton-pass, pursuit, iron-tail, hidden-power, rain-dance, sunny-day, shadow-ball, rock-smash, beat-up, fake-out, uproar, facade, focus-punch, taunt, helping-hand, role-play, revenge, brick-break, knock-off, endeavor, snatch, secret-power, astonish, tickle, aerial-ace, bounce, mud-shot, covet, shock-wave, water-pulse, natural-gift, u-turn, payback, fling, last-resort, seed-bomb, switcheroo, nasty-plot, shadow-claw, mud-bomb, gunk-shot, captivate, grass-knot, double-hit, hone-claws, smack-down, low-sweep, foul-play, round, quick-guard, acrobatics, retaliate, work-up, tail-slap, confide, power-up-punch, throat-chop, tera-blast, trailblaze, chilling-water, upper-hand"
191,Sunkern,Grass,NULL,Chlorophyll,Solar Power,Early Bird,50,36,30,30,30,30,30,30,180,4.0 lbs.,"1'00""",Seed Pokémon,Grass,NULL,"swords-dance, cut, tackle, take-down, double-edge, absorb, mega-drain, leech-seed, growth, razor-leaf, solar-beam, toxic, mimic, double-team, light-screen, bide, flash, rest, substitute, snore, curse, protect, sludge-bomb, giga-drain, endure, swagger, attract, sleep-talk, return, frustration, safeguard, encore, sweet-scent, morning-sun, synthesis, hidden-power, rain-dance, sunny-day, uproar, facade, nature-power, helping-hand, ingrain, endeavor, secret-power, weather-ball, grass-whistle, bullet-seed, magical-leaf, natural-gift, worry-seed, seed-bomb, energy-ball, earth-power, leaf-storm, captivate, grass-knot, after-you, round, grassy-terrain, confide, tera-blast, trailblaze"
192,Sunflora,Grass,NULL,Chlorophyll,Solar Power,Early Bird,50,149,75,75,55,105,85,30,425,18.7 lbs.,"2'07""",Sun Pokémon,Grass,NULL,"pound, swords-dance, cut, tackle, take-down, double-edge, hyper-beam, absorb, mega-drain, leech-seed, growth, razor-leaf, solar-beam, petal-dance, toxic, mimic, double-team, light-screen, flash, rest, substitute, snore, curse, protect, sludge-bomb, giga-drain, endure, swagger, attract, sleep-talk, return, frustration, safeguard, encore, sweet-scent, synthesis, hidden-power, rain-dance, sunny-day, uproar, facade, nature-power, helping-hand, ingrain, endeavor, secret-power, weather-ball, grass-whistle, bullet-seed, magical-leaf, natural-gift, worry-seed, seed-bomb, energy-ball, earth-power, giga-impact, leaf-storm, captivate, grass-knot, after-you, round, petal-blizzard, flower-shield, grassy-terrain, confide, dazzling-gleam, grassy-glide, tera-blast, trailblaze"
193,Yanma,Bug,Flying,Speed Boost,Compound Eyes,Frisk,50,78,65,65,45,75,45,95,390,83.8 lbs.,"3'11""",Clear Wing Pokémon,Bug,NULL,"swords-dance, gust, wing-attack, whirlwind, headbutt, tackle, take-down, double-edge, supersonic, sonic-boom, solar-beam, string-shot, toxic, psychic, hypnosis, quick-attack, mimic, screech, double-team, swift, dream-eater, leech-life, flash, rest, substitute, thief, snore, curse, reversal, protect, feint-attack, foresight, detect, giga-drain, endure, swagger, steel-wing, attract, sleep-talk, return, frustration, pursuit, hidden-power, sunny-day, psych-up, ancient-power, shadow-ball, uproar, facade, secret-power, air-cutter, silver-wind, signal-beam, aerial-ace, roost, natural-gift, feint, tailwind, u-turn, air-slash, bug-buzz, defog, captivate, bug-bite, ominous-wind, round, struggle-bug, confide, lunge, skitter-smack, tera-blast, pounce, psychic-noise"
194,Wooper,Water,Ground,Damp,Water Absorb,Unaware,50,42,55,45,45,25,25,15,210,18.7 lbs.,"1'04""",Water Fish Pokémon,Water 1,Field,"ice-punch, slam, double-kick, headbutt, body-slam, take-down, double-edge, tail-whip, mist, water-gun, hydro-pump, surf, ice-beam, blizzard, counter, earthquake, dig, toxic, mimic, double-team, recover, defense-curl, haze, waterfall, amnesia, flash, rest, rock-slide, substitute, snore, curse, protect, sludge-bomb, mud-slap, spikes, icy-wind, sandstorm, endure, rollout, swagger, attract, sleep-talk, return, frustration, safeguard, dynamic-punch, encore, iron-tail, hidden-power, rain-dance, ancient-power, rock-smash, whirlpool, stockpile, spit-up, swallow, hail, facade, helping-hand, yawn, secret-power, dive, mud-sport, rock-tomb, muddy-water, mud-shot, water-pulse, natural-gift, guard-swap, aqua-tail, earth-power, avalanche, mud-bomb, stone-edge, captivate, stealth-rock, sludge-wave, acid-spray, after-you, round, scald, bulldoze, confide, eerie-impulse, infestation, power-up-punch, stomping-tantrum, liquidation, tera-blast, snowscape, trailblaze, chilling-water"
195,Quagsire,Water,Ground,Damp,Water Absorb,Unaware,50,151,95,85,85,65,65,35,430,165.3 lbs.,"4'07""",Water Fish Pokémon,Water 1,Field,"mega-punch, ice-punch, slam, mega-kick, headbutt, body-slam, take-down, double-edge, tail-whip, mist, water-gun, hydro-pump, surf, ice-beam, blizzard, hyper-beam, counter, seismic-toss, strength, earthquake, dig, toxic, mimic, double-team, defense-curl, haze, waterfall, amnesia, flash, rest, rock-slide, substitute, thief, snore, curse, protect, sludge-bomb, mud-slap, spikes, icy-wind, sandstorm, endure, rollout, swagger, attract, sleep-talk, return, frustration, safeguard, dynamic-punch, encore, iron-tail, hidden-power, rain-dance, ancient-power, rock-smash, whirlpool, hail, facade, focus-punch, helping-hand, brick-break, yawn, secret-power, dive, mud-sport, rock-tomb, muddy-water, mud-shot, water-pulse, natural-gift, fling, guard-swap, toxic-spikes, aqua-tail, drain-punch, focus-blast, earth-power, giga-impact, avalanche, mud-bomb, stone-edge, captivate, stealth-rock, sludge-wave, acid-spray, after-you, round, scald, bulldoze, confide, eerie-impulse, infestation, power-up-punch, high-horsepower, stomping-tantrum, liquidation, body-press, tera-blast, snowscape, trailblaze, chilling-water"
196,Espeon,Psychic,NULL,Synchronize,NULL,Magic Bounce,50,184,65,65,60,130,95,110,525,58.4 lbs.,"2'11""",Sun Pokémon,Field,NULL,"pay-day, cut, sand-attack, headbutt, tackle, body-slam, take-down, double-edge, tail-whip, bite, growl, roar, psybeam, hyper-beam, thunder-wave, dig, toxic, confusion, psychic, quick-attack, mimic, double-team, confuse-ray, light-screen, reflect, focus-energy, swift, dream-eater, flash, rest, substitute, nightmare, snore, curse, protect, mud-slap, zap-cannon, detect, endure, charm, swagger, attract, sleep-talk, heal-bell, return, frustration, baton-pass, iron-tail, morning-sun, hidden-power, rain-dance, sunny-day, psych-up, shadow-ball, future-sight, facade, helping-hand, trick, magic-coat, skill-swap, imprison, secret-power, hyper-voice, weather-ball, fake-tears, signal-beam, covet, magical-leaf, calm-mind, gravity, natural-gift, copycat, power-swap, last-resort, power-gem, giga-impact, zen-headbutt, trick-room, captivate, grass-knot, psyshock, telekinesis, magic-room, round, echoed-voice, stored-power, ally-switch, retaliate, work-up, draining-kiss, confide, dazzling-gleam, baby-doll-eyes, laser-focus, psychic-terrain, psychic-fangs, expanding-force, tera-blast, trailblaze, alluring-voice, psychic-noise"
197,Umbreon,Dark,NULL,Synchronize,NULL,Inner Focus,50,184,95,65,110,60,130,65,525,59.5 lbs.,"3'03""",Moonlight Pokémon,Field,NULL,"pay-day, cut, sand-attack, headbutt, tackle, body-slam, take-down, double-edge, tail-whip, bite, growl, roar, hyper-beam, thunder-wave, dig, toxic, psychic, quick-attack, mimic, screech, double-team, confuse-ray, light-screen, reflect, focus-energy, swift, dream-eater, flash, rest, substitute, thief, nightmare, snore, curse, spite, protect, scary-face, feint-attack, mud-slap, zap-cannon, detect, endure, charm, swagger, mean-look, attract, sleep-talk, heal-bell, return, frustration, baton-pass, pursuit, iron-tail, moonlight, hidden-power, rain-dance, sunny-day, crunch, psych-up, shadow-ball, torment, facade, taunt, helping-hand, skill-swap, snatch, secret-power, hyper-voice, weather-ball, fake-tears, covet, calm-mind, natural-gift, payback, assurance, copycat, guard-swap, last-resort, sucker-punch, dark-pulse, giga-impact, captivate, wonder-room, foul-play, round, echoed-voice, stored-power, retaliate, work-up, snarl, confide, baby-doll-eyes, laser-focus, throat-chop, lash-out, tera-blast, trailblaze, alluring-voice"
198,Murkrow,Dark,Flying,Insomnia,Super Luck,Prankster,50,81,60,85,42,85,42,91,405,4.6 lbs.,"1'08""",Darkness Pokémon,Flying,NULL,"gust, wing-attack, whirlwind, fly, take-down, double-edge, hyper-beam, peck, drill-peck, thunder-wave, toxic, psychic, quick-attack, night-shade, mimic, screech, double-team, confuse-ray, haze, mirror-move, swift, dream-eater, sky-attack, rest, substitute, thief, nightmare, snore, curse, spite, protect, scary-face, feint-attack, mud-slap, perish-song, icy-wind, detect, endure, swagger, steel-wing, mean-look, attract, sleep-talk, return, frustration, pursuit, hidden-power, twister, rain-dance, sunny-day, psych-up, shadow-ball, uproar, heat-wave, torment, flatter, facade, taunt, snatch, secret-power, feather-dance, astonish, air-cutter, aerial-ace, calm-mind, roost, natural-gift, pluck, tailwind, u-turn, payback, assurance, embargo, psycho-shift, punishment, sucker-punch, dark-pulse, night-slash, air-slash, brave-bird, giga-impact, nasty-plot, defog, captivate, ominous-wind, foul-play, round, hex, quash, acrobatics, retaliate, hurricane, snarl, confide, lash-out, dual-wingbeat, tera-blast, psychic-noise"
199,Slowking,Water,Psychic,Oblivious,Own Tempo,Regenerator,50,172,95,75,80,100,110,30,490,175.3 lbs.,"6'07""",Royal Pokémon,Monster,Water 1,"mega-punch, pay-day, fire-punch, ice-punch, thunder-punch, mega-kick, headbutt, tackle, body-slam, take-down, double-edge, growl, disable, flamethrower, water-gun, hydro-pump, surf, ice-beam, blizzard, psybeam, hyper-beam, counter, seismic-toss, strength, thunder-wave, earthquake, dig, toxic, confusion, psychic, mimic, double-team, light-screen, reflect, metronome, fire-blast, waterfall, swift, amnesia, dream-eater, flash, rest, rock-slide, tri-attack, substitute, nightmare, snore, curse, protect, mud-slap, zap-cannon, icy-wind, endure, swagger, fury-cutter, attract, sleep-talk, return, frustration, safeguard, dynamic-punch, iron-tail, hidden-power, rain-dance, sunny-day, psych-up, shadow-ball, future-sight, rock-smash, whirlpool, hail, facade, focus-punch, trick, magic-coat, recycle, brick-break, yawn, skill-swap, imprison, secret-power, dive, slack-off, weather-ball, rock-tomb, signal-beam, muddy-water, iron-defense, block, mud-shot, calm-mind, water-pulse, brine, natural-gift, fling, trump-card, aqua-tail, power-gem, drain-punch, focus-blast, giga-impact, nasty-plot, avalanche, zen-headbutt, trick-room, captivate, grass-knot, wonder-room, psyshock, telekinesis, foul-play, after-you, round, echoed-voice, stored-power, ally-switch, scald, heal-pulse, incinerate, quash, bulldoze, dragon-tail, razor-shell, confide, power-up-punch, laser-focus, psychic-terrain, liquidation, expanding-force, tera-blast, chilly-reception, snowscape, chilling-water, psychic-noise"
200,Misdreavus,Ghost,NULL,Levitate,NULL,NULL,50,87,60,60,60,85,85,85,435,2.2 lbs.,"2'04""",Screech Pokémon,Amorphous,NULL,"headbutt, double-edge, growl, psybeam, hyper-beam, thunderbolt, thunder-wave, thunder, toxic, confusion, psychic, hypnosis, night-shade, mimic, screech, double-team, confuse-ray, defense-curl, swift, dream-eater, flash, psywave, rest, substitute, thief, nightmare, snore, curse, spite, protect, scary-face, zap-cannon, destiny-bond, perish-song, icy-wind, endure, charm, swagger, mean-look, attract, sleep-talk, heal-bell, return, frustration, pain-split, hidden-power, rain-dance, sunny-day, psych-up, shadow-ball, future-sight, uproar, torment, will-o-wisp, memento, facade, taunt, helping-hand, trick, magic-coat, skill-swap, imprison, grudge, snatch, secret-power, hyper-voice, astonish, fake-tears, extrasensory, aerial-ace, magical-leaf, calm-mind, shock-wave, natural-gift, payback, embargo, me-first, sucker-punch, dark-pulse, power-gem, energy-ball, giga-impact, nasty-plot, shadow-sneak, trick-room, captivate, grass-knot, charge-beam, ominous-wind, wonder-room, psyshock, telekinesis, magic-room, foul-play, round, echoed-voice, stored-power, ally-switch, hex, phantom-force, draining-kiss, confide, dazzling-gleam, burning-jealousy, poltergeist, tera-blast, snowscape, psychic-noise"
201,Unown,Psychic,NULL,Levitate,NULL,NULL,50,118,48,72,48,72,48,48,336,11.0 lbs.,"1'08""",Symbol Pokémon,Undiscovered,NULL,hidden-power
202,Wobbuffet,Psychic,NULL,Shadow Tag,NULL,Telepathy,50,142,190,33,58,33,58,33,405,62.8 lbs.,"4'03""",Patient Pokémon,Amorphous,NULL,"counter, amnesia, splash, destiny-bond, charm, safeguard, encore, mirror-coat"
203,Girafarig,Normal,Psychic,Inner Focus,Early Bird,Sap Sipper,50,159,70,80,65,90,65,85,455,91.5 lbs.,"4'11""",Long Neck Pokémon,Field,NULL,"razor-wind, stomp, double-kick, headbutt, tackle, body-slam, take-down, double-edge, growl, psybeam, hyper-beam, low-kick, strength, thunderbolt, thunder-wave, thunder, earthquake, toxic, confusion, psychic, agility, mimic, double-team, confuse-ray, light-screen, reflect, swift, amnesia, dream-eater, flash, rest, substitute, thief, nightmare, snore, curse, protect, mud-slap, zap-cannon, foresight, endure, swagger, mean-look, attract, sleep-talk, return, frustration, baton-pass, iron-tail, hidden-power, rain-dance, sunny-day, crunch, mirror-coat, psych-up, shadow-ball, future-sight, rock-smash, beat-up, uproar, facade, helping-hand, trick, wish, magic-coat, recycle, endeavor, skill-swap, imprison, secret-power, hyper-voice, astonish, odor-sleuth, signal-beam, calm-mind, shock-wave, gravity, natural-gift, assurance, power-swap, guard-swap, sucker-punch, energy-ball, giga-impact, nasty-plot, zen-headbutt, trick-room, captivate, grass-knot, charge-beam, double-hit, psyshock, telekinesis, foul-play, round, echoed-voice, stored-power, ally-switch, retaliate, bulldoze, work-up, confide, dazzling-gleam, high-horsepower, psychic-terrain, psychic-fangs, stomping-tantrum, expanding-force, tera-blast, trailblaze, twin-beam, psychic-noise"
204,Pineco,Bug,NULL,Sturdy,NULL,Overcoat,50,58,50,65,90,35,35,15,290,15.9 lbs.,"2'00""",Bagworm Pokémon,Bug,NULL,"headbutt, tackle, body-slam, take-down, double-edge, pin-missile, counter, strength, solar-beam, string-shot, earthquake, dig, toxic, mimic, double-team, defense-curl, light-screen, reflect, bide, self-destruct, swift, explosion, rest, rock-slide, substitute, snore, curse, flail, reversal, protect, spikes, sandstorm, giga-drain, endure, rollout, swagger, attract, sleep-talk, return, frustration, pain-split, rapid-spin, sweet-scent, hidden-power, rain-dance, sunny-day, rock-smash, facade, helping-hand, revenge, secret-power, rock-tomb, sand-tomb, iron-defense, rock-blast, gravity, gyro-ball, natural-gift, payback, power-trick, toxic-spikes, poison-jab, seed-bomb, bug-buzz, captivate, stealth-rock, bug-bite, venoshock, autotomize, round, struggle-bug, bulldoze, drill-run, confide, lunge, tera-blast, ice-spinner, pounce"
