Index,Species,Type1,Type2,Ability1,Ability2,Ability3,level,base_experience,HP,Attack,Defence,Sp.Attack,Sp.Defence,Speed,Total,Weight,Height,Seed Type,Egg Type1,Egg Type2,Moves
370,Luvdisc,Water,NULL,Swift Swim,NULL,Hydration,50,116,43,30,55,40,65,97,330,19.2 lbs.,"2'00""",Rendezvous Pokémon,Water 2,NULL,"tackle, take-down, double-edge, supersonic, water-gun, hydro-pump, surf, ice-beam, blizzard, toxic, agility, mimic, double-team, waterfall, swift, splash, rest, substitute, snore, flail, protect, sweet-kiss, icy-wind, endure, charm, swagger, attract, sleep-talk, return, frustration, safeguard, hidden-power, rain-dance, psych-up, whirlpool, hail, facade, wish, endeavor, secret-power, dive, mud-sport, bounce, water-sport, water-pulse, brine, natural-gift, lucky-chant, aqua-ring, captivate, aqua-jet, soak, entrainment, round, scald, heal-pulse, heart-stamp, draining-kiss, confide, baby-doll-eyes, liquidation, tearful-look, scale-shot, flip-turn, tera-blast, snowscape"
371,Bagon,Dragon,NULL,Rock Head,NULL,Sheer Force,50,60,45,75,60,40,30,50,300,92.8 lbs.,"2'00""",Rock Head Pokémon,Dragon,NULL,"cut, headbutt, body-slam, take-down, thrash, double-edge, leer, bite, roar, ember, flamethrower, hydro-pump, strength, dragon-rage, fire-spin, toxic, rage, mimic, double-team, defense-curl, focus-energy, fire-blast, rest, rock-slide, substitute, snore, protect, scary-face, mud-slap, outrage, endure, swagger, fury-cutter, attract, sleep-talk, return, frustration, dragon-breath, hidden-power, twister, rain-dance, sunny-day, crunch, rock-smash, facade, helping-hand, brick-break, secret-power, hyper-voice, rock-tomb, aerial-ace, iron-defense, dragon-claw, dragon-dance, natural-gift, dragon-pulse, dragon-rush, shadow-claw, thunder-fang, fire-fang, zen-headbutt, draco-meteor, iron-head, captivate, hone-claws, round, incinerate, dragon-tail, confide, tera-blast, dragon-cheer"
372,Shelgon,Dragon,NULL,Rock Head,NULL,Overcoat,50,147,65,95,100,60,50,50,420,243.6 lbs.,"3'07""",Endurance Pokémon,Dragon,NULL,"cut, headbutt, body-slam, take-down, double-edge, leer, bite, roar, ember, flamethrower, hydro-pump, strength, fire-spin, toxic, rage, mimic, double-team, defense-curl, focus-energy, fire-blast, rest, rock-slide, substitute, snore, protect, scary-face, mud-slap, outrage, endure, rollout, swagger, fury-cutter, attract, sleep-talk, return, frustration, dragon-breath, hidden-power, twister, rain-dance, sunny-day, crunch, rock-smash, facade, helping-hand, brick-break, secret-power, hyper-voice, rock-tomb, aerial-ace, iron-defense, dragon-claw, dragon-dance, natural-gift, dragon-pulse, shadow-claw, thunder-fang, fire-fang, zen-headbutt, draco-meteor, iron-head, captivate, hone-claws, round, incinerate, dragon-tail, confide, tera-blast, dragon-cheer, temper-flare"
373,Salamence,Dragon,Flying,Intimidate,NULL,Moxie,50,300,95,135,80,110,80,100,600,226.2 lbs.,"4'11""",Dragon Pokémon,Dragon,NULL,"cut, fly, headbutt, body-slam, take-down, double-edge, leer, bite, roar, ember, flamethrower, hydro-pump, hyper-beam, strength, fire-spin, earthquake, toxic, rage, mimic, double-team, defense-curl, focus-energy, fire-blast, swift, rest, rock-slide, substitute, snore, protect, scary-face, mud-slap, outrage, endure, rollout, swagger, fury-cutter, steel-wing, attract, sleep-talk, return, frustration, dragon-breath, iron-tail, hidden-power, twister, rain-dance, sunny-day, crunch, rock-smash, heat-wave, facade, helping-hand, brick-break, secret-power, hyper-voice, air-cutter, rock-tomb, aerial-ace, iron-defense, dragon-claw, dragon-dance, roost, natural-gift, tailwind, aqua-tail, air-slash, dragon-pulse, giga-impact, shadow-claw, thunder-fang, fire-fang, zen-headbutt, defog, draco-meteor, iron-head, stone-edge, captivate, ominous-wind, hone-claws, round, incinerate, bulldoze, dragon-tail, hurricane, confide, laser-focus, brutal-swing, psychic-fangs, breaking-swipe, dual-wingbeat, tera-blast, dragon-cheer, temper-flare"
374,Beldum,Steel,Psychic,Clear Body,NULL,Light Metal,50,60,40,55,80,35,60,30,300,209.9 lbs.,"2'00""",Iron Ball Pokémon,Mineral,NULL,"headbutt, tackle, take-down, iron-defense, zen-headbutt, iron-head, steel-beam, tera-blast"
375,Metang,Steel,Psychic,Clear Body,NULL,Light Metal,50,147,60,75,100,55,80,50,420,446.4 lbs.,"3'11""",Iron Claw Pokémon,Mineral,NULL,"ice-punch, thunder-punch, cut, headbutt, tackle, body-slam, take-down, double-edge, hyper-beam, strength, earthquake, toxic, confusion, psychic, agility, mimic, double-team, defense-curl, light-screen, reflect, self-destruct, swift, flash, explosion, rest, rock-slide, substitute, snore, protect, scary-face, sludge-bomb, mud-slap, icy-wind, sandstorm, endure, rollout, swagger, fury-cutter, sleep-talk, return, frustration, dynamic-punch, pursuit, metal-claw, hidden-power, rain-dance, sunny-day, psych-up, shadow-ball, future-sight, rock-smash, facade, focus-punch, trick, brick-break, secret-power, meteor-mash, rock-tomb, cosmic-power, signal-beam, aerial-ace, iron-defense, gravity, miracle-eye, gyro-ball, natural-gift, magnet-rise, rock-polish, giga-impact, bullet-punch, psycho-cut, zen-headbutt, flash-cannon, iron-head, stealth-rock, grass-knot, hone-claws, psyshock, telekinesis, heavy-slam, round, ally-switch, bulldoze, confide, power-up-punch, steel-beam, expanding-force, steel-roller, meteor-beam, tera-blast, trailblaze, hard-press, psychic-noise"
376,Metagross,Steel,Psychic,Clear Body,NULL,Light Metal,50,300,80,135,130,95,90,70,600,1212.5 lbs.,"5'03""",Iron Leg Pokémon,Mineral,NULL,"ice-punch, thunder-punch, cut, headbutt, tackle, body-slam, take-down, double-edge, hyper-beam, strength, earthquake, toxic, confusion, psychic, agility, mimic, double-team, defense-curl, light-screen, reflect, self-destruct, swift, flash, explosion, rest, rock-slide, substitute, snore, protect, scary-face, sludge-bomb, mud-slap, icy-wind, sandstorm, endure, rollout, swagger, fury-cutter, sleep-talk, return, frustration, dynamic-punch, pursuit, metal-claw, hidden-power, rain-dance, sunny-day, psych-up, shadow-ball, future-sight, rock-smash, facade, focus-punch, trick, brick-break, knock-off, secret-power, meteor-mash, rock-tomb, cosmic-power, signal-beam, aerial-ace, iron-defense, block, gravity, miracle-eye, hammer-arm, gyro-ball, natural-gift, magnet-rise, rock-polish, giga-impact, bullet-punch, shadow-claw, psycho-cut, zen-headbutt, flash-cannon, iron-head, stone-edge, stealth-rock, grass-knot, hone-claws, psyshock, telekinesis, heavy-slam, round, ally-switch, bulldoze, confide, power-up-punch, laser-focus, brutal-swing, psychic-fangs, stomping-tantrum, body-press, steel-beam, expanding-force, steel-roller, meteor-beam, tera-blast, trailblaze, hard-press, psychic-noise"
377,Regirock,Rock,NULL,Clear Body,NULL,Sturdy,50,290,80,100,200,50,100,50,580,507.1 lbs.,"5'07""",Rock Peak Pokémon,Undiscovered,NULL,"mega-punch, fire-punch, ice-punch, thunder-punch, stomp, mega-kick, headbutt, body-slam, take-down, double-edge, hyper-beam, counter, seismic-toss, strength, thunderbolt, thunder-wave, thunder, rock-throw, earthquake, dig, toxic, mimic, double-team, defense-curl, self-destruct, explosion, rest, rock-slide, substitute, snore, curse, protect, mud-slap, zap-cannon, lock-on, sandstorm, endure, rollout, swagger, sleep-talk, return, frustration, safeguard, dynamic-punch, hidden-power, sunny-day, psych-up, ancient-power, rock-smash, facade, focus-punch, superpower, brick-break, secret-power, rock-tomb, sand-tomb, iron-defense, block, rock-blast, shock-wave, gravity, hammer-arm, natural-gift, fling, rock-polish, power-gem, drain-punch, focus-blast, earth-power, giga-impact, flash-cannon, rock-climb, iron-head, stone-edge, stealth-rock, charge-beam, smack-down, heavy-slam, round, bulldoze, confide, power-up-punch, stomping-tantrum, body-press, meteor-beam, tera-blast, hard-press"
378,Regice,Ice,NULL,Clear Body,NULL,Ice Body,50,290,80,50,100,100,200,50,580,385.8 lbs.,"5'11""",Iceberg Pokémon,Undiscovered,NULL,"mega-punch, ice-punch, thunder-punch, stomp, mega-kick, headbutt, body-slam, double-edge, ice-beam, blizzard, hyper-beam, counter, seismic-toss, strength, thunderbolt, thunder-wave, thunder, earthquake, toxic, mimic, double-team, defense-curl, self-destruct, amnesia, explosion, rest, rock-slide, substitute, snore, curse, protect, mud-slap, zap-cannon, icy-wind, lock-on, endure, rollout, swagger, sleep-talk, return, frustration, safeguard, dynamic-punch, hidden-power, rain-dance, psych-up, ancient-power, rock-smash, hail, facade, focus-punch, superpower, brick-break, secret-power, rock-tomb, signal-beam, icicle-spear, block, shock-wave, gravity, hammer-arm, natural-gift, fling, rock-polish, focus-blast, giga-impact, avalanche, flash-cannon, rock-climb, iron-head, charge-beam, heavy-slam, round, bulldoze, frost-breath, confide, power-up-punch, aurora-veil, stomping-tantrum, body-press, tera-blast, ice-spinner, snowscape"
379,Registeel,Steel,NULL,Clear Body,NULL,Light Metal,50,290,80,75,150,75,150,50,580,451.9 lbs.,"6'03""",Iron Pokémon,Undiscovered,NULL,"mega-punch, ice-punch, thunder-punch, stomp, mega-kick, headbutt, body-slam, take-down, double-edge, hyper-beam, counter, seismic-toss, strength, thunderbolt, thunder-wave, thunder, earthquake, toxic, mimic, double-team, defense-curl, self-destruct, amnesia, explosion, rest, rock-slide, substitute, snore, curse, protect, mud-slap, zap-cannon, lock-on, sandstorm, endure, rollout, swagger, sleep-talk, return, frustration, safeguard, dynamic-punch, metal-claw, hidden-power, rain-dance, sunny-day, psych-up, ancient-power, rock-smash, facade, focus-punch, superpower, brick-break, secret-power, rock-tomb, metal-sound, sand-tomb, aerial-ace, iron-defense, block, shock-wave, gravity, hammer-arm, natural-gift, fling, magnet-rise, rock-polish, focus-blast, giga-impact, shadow-claw, flash-cannon, rock-climb, iron-head, stealth-rock, charge-beam, hone-claws, heavy-slam, round, bulldoze, confide, power-up-punch, stomping-tantrum, body-press, steel-beam, steel-roller, meteor-beam, tera-blast, ice-spinner, hard-press"
380,Latias,Dragon,Psychic,Levitate,NULL,NULL,50,300,80,80,90,110,130,110,600,88.2 lbs.,"4'07""",Eon Pokémon,Undiscovered,NULL,"cut, fly, body-slam, take-down, double-edge, roar, surf, ice-beam, hyper-beam, solar-beam, thunderbolt, thunder-wave, thunder, earthquake, toxic, confusion, psychic, agility, mimic, double-team, recover, light-screen, reflect, waterfall, swift, dream-eater, flash, psywave, rest, tri-attack, substitute, snore, protect, mud-slap, icy-wind, outrage, sandstorm, endure, charm, swagger, fury-cutter, steel-wing, attract, sleep-talk, return, frustration, safeguard, dragon-breath, baton-pass, hidden-power, twister, rain-dance, sunny-day, psych-up, shadow-ball, future-sight, whirlpool, facade, helping-hand, trick, role-play, wish, magic-coat, refresh, secret-power, dive, mist-ball, weather-ball, air-cutter, aerial-ace, dragon-claw, covet, water-sport, calm-mind, dragon-dance, shock-wave, water-pulse, roost, healing-wish, natural-gift, tailwind, psycho-shift, last-resort, sucker-punch, aura-sphere, air-slash, dragon-pulse, energy-ball, giga-impact, shadow-claw, psycho-cut, zen-headbutt, defog, draco-meteor, captivate, grass-knot, charge-beam, hone-claws, guard-split, psyshock, telekinesis, magic-room, round, stored-power, ally-switch, heal-pulse, reflect-type, retaliate, bulldoze, disarming-voice, draining-kiss, confide, mystical-fire, laser-focus, liquidation, breaking-swipe, scale-shot, dual-wingbeat, tera-blast, chilling-water, dragon-cheer, alluring-voice"
381,Latios,Dragon,Psychic,Levitate,NULL,NULL,50,300,80,90,80,130,110,110,600,132.3 lbs.,"6'07""",Eon Pokémon,Undiscovered,NULL,"cut, fly, body-slam, take-down, double-edge, roar, surf, ice-beam, hyper-beam, solar-beam, thunderbolt, thunder-wave, thunder, earthquake, toxic, confusion, psychic, agility, mimic, double-team, recover, light-screen, reflect, waterfall, swift, dream-eater, flash, psywave, rest, tri-attack, substitute, snore, protect, mud-slap, icy-wind, outrage, sandstorm, endure, swagger, fury-cutter, steel-wing, attract, sleep-talk, return, frustration, safeguard, dragon-breath, baton-pass, hidden-power, twister, rain-dance, sunny-day, psych-up, shadow-ball, future-sight, whirlpool, memento, facade, helping-hand, trick, magic-coat, refresh, secret-power, dive, luster-purge, weather-ball, air-cutter, aerial-ace, dragon-claw, calm-mind, dragon-dance, shock-wave, water-pulse, roost, natural-gift, tailwind, psycho-shift, heal-block, last-resort, aura-sphere, air-slash, dragon-pulse, energy-ball, giga-impact, shadow-claw, psycho-cut, zen-headbutt, defog, draco-meteor, captivate, grass-knot, charge-beam, hone-claws, power-split, wonder-room, psyshock, telekinesis, simple-beam, round, stored-power, ally-switch, heal-pulse, retaliate, bulldoze, confide, mystical-fire, laser-focus, liquidation, breaking-swipe, scale-shot, flip-turn, dual-wingbeat, tera-blast, chilling-water, dragon-cheer, psychic-noise"
382,Kyogre,Water,NULL,Drizzle,NULL,NULL,50,335,100,100,90,150,140,90,670,776.0 lbs.,"14'09""",Sea Basin Pokémon,Undiscovered,NULL,"headbutt, body-slam, take-down, double-edge, roar, hydro-pump, surf, ice-beam, blizzard, hyper-beam, strength, thunderbolt, thunder-wave, thunder, earthquake, toxic, mimic, double-team, defense-curl, waterfall, swift, rest, rock-slide, substitute, snore, protect, scary-face, mud-slap, icy-wind, endure, swagger, sleep-talk, return, frustration, safeguard, hidden-power, rain-dance, psych-up, ancient-power, rock-smash, whirlpool, uproar, hail, facade, helping-hand, brick-break, secret-power, dive, rock-tomb, water-spout, signal-beam, sheer-cold, muddy-water, block, calm-mind, shock-wave, water-pulse, brine, natural-gift, aqua-ring, aqua-tail, giga-impact, avalanche, iron-head, heavy-slam, round, scald, bulldoze, confide, origin-pulse, liquidation, tera-blast, chilling-water"
383,Groudon,Ground,NULL,Drought,NULL,NULL,50,335,100,150,140,100,90,90,670,2094.4 lbs.,"11'06""",Continent Pokémon,Undiscovered,NULL,"mega-punch, fire-punch, thunder-punch, swords-dance, cut, mega-kick, headbutt, body-slam, take-down, double-edge, roar, flamethrower, hyper-beam, counter, seismic-toss, strength, solar-beam, thunderbolt, thunder-wave, thunder, earthquake, fissure, dig, toxic, mimic, double-team, defense-curl, fire-blast, swift, rest, rock-slide, slash, substitute, snore, protect, scary-face, mud-slap, spikes, sandstorm, endure, rollout, swagger, fury-cutter, sleep-talk, return, frustration, safeguard, dynamic-punch, iron-tail, metal-claw, hidden-power, sunny-day, crunch, psych-up, ancient-power, rock-smash, uproar, heat-wave, will-o-wisp, facade, focus-punch, helping-hand, brick-break, eruption, secret-power, overheat, rock-tomb, sand-tomb, aerial-ace, block, dragon-claw, bulk-up, mud-shot, rock-blast, shock-wave, hammer-arm, natural-gift, fling, rock-polish, dragon-pulse, focus-blast, earth-power, giga-impact, shadow-claw, fire-fang, zen-headbutt, rock-climb, lava-plume, iron-head, stone-edge, stealth-rock, hone-claws, smack-down, heavy-slam, round, incinerate, bulldoze, dragon-tail, heat-crash, confide, power-up-punch, precipice-blades, high-horsepower, brutal-swing, stomping-tantrum, body-press, scorching-sands, tera-blast"
384,Rayquaza,Dragon,Flying,Air Lock,NULL,NULL,50,340,105,150,90,150,90,95,680,455.2 lbs.,"23'00""",Sky High Pokémon,Undiscovered,NULL,"swords-dance, fly, bind, headbutt, body-slam, take-down, double-edge, roar, flamethrower, hydro-pump, surf, ice-beam, blizzard, hyper-beam, strength, solar-beam, thunderbolt, thunder-wave, thunder, earthquake, toxic, mimic, double-team, fire-blast, waterfall, swift, rest, rock-slide, substitute, snore, protect, scary-face, mud-slap, icy-wind, outrage, sandstorm, endure, swagger, fury-cutter, sleep-talk, return, frustration, iron-tail, hidden-power, twister, rain-dance, sunny-day, crunch, psych-up, extreme-speed, ancient-power, rock-smash, whirlpool, uproar, facade, helping-hand, brick-break, secret-power, dive, hyper-voice, overheat, rock-tomb, cosmic-power, aerial-ace, dragon-claw, bulk-up, dragon-dance, shock-wave, water-pulse, gyro-ball, natural-gift, tailwind, u-turn, fling, aqua-tail, air-slash, dragon-pulse, focus-blast, energy-ball, earth-power, giga-impact, avalanche, shadow-claw, defog, draco-meteor, iron-head, stone-edge, stealth-rock, hone-claws, round, echoed-voice, sky-drop, incinerate, bulldoze, dragon-tail, wild-charge, hurricane, confide, dragon-ascent, brutal-swing, breaking-swipe, scale-shot, meteor-beam, tera-blast, dragon-cheer"
385,Jirachi,Steel,Psychic,Serene Grace,NULL,NULL,50,300,100,100,100,100,100,100,600,2.4 lbs.,"1'00""",Wish Pokémon,Undiscovered,NULL,"mega-punch, fire-punch, ice-punch, thunder-punch, mega-kick, headbutt, body-slam, double-edge, psybeam, hyper-beam, thunderbolt, thunder-wave, thunder, toxic, confusion, psychic, mimic, double-team, confuse-ray, defense-curl, light-screen, reflect, metronome, swift, amnesia, dream-eater, flash, rest, substitute, nightmare, snore, protect, mud-slap, icy-wind, sandstorm, endure, charm, swagger, sleep-talk, return, frustration, safeguard, dynamic-punch, baton-pass, encore, hidden-power, rain-dance, sunny-day, psych-up, ancient-power, shadow-ball, future-sight, uproar, facade, helping-hand, trick, wish, magic-coat, recycle, skill-swap, imprison, refresh, secret-power, meteor-mash, fake-tears, metal-sound, cosmic-power, signal-beam, aerial-ace, iron-defense, calm-mind, shock-wave, water-pulse, doom-desire, gravity, healing-wish, natural-gift, u-turn, fling, lucky-chant, last-resort, aura-sphere, drain-punch, energy-ball, giga-impact, zen-headbutt, flash-cannon, trick-room, iron-head, stealth-rock, grass-knot, charge-beam, psyshock, telekinesis, magic-room, round, stored-power, ally-switch, play-rough, confide, dazzling-gleam, power-up-punch, life-dew, steel-beam, expanding-force, meteor-beam, tera-blast, psychic-noise"
386,Deoxys,Psychic,NULL,Pressure,NULL,NULL,20,270,50,150,50,150,50,150,600,134.0 lbs.,"5'07""",DNA Pokémon,Undiscovered,NULL,"Psycho Boost, Ice Beam ,Thunderbolt,Superpower / Knock Off / Dark Pulse"
387,Turtwig,Grass,NULL,Overgrow,NULL,Shell Armor,50,64,55,68,64,45,55,31,318,22.5 lbs.,"1'04""",Tiny Leaf Pokémon,Monster,Grass,"swords-dance, cut, headbutt, tackle, body-slam, take-down, thrash, double-edge, bite, roar, strength, absorb, mega-drain, leech-seed, growth, razor-leaf, solar-beam, sleep-powder, toxic, double-team, withdraw, light-screen, reflect, amnesia, flash, rest, substitute, snore, curse, protect, mud-slap, giga-drain, endure, swagger, attract, sleep-talk, return, frustration, safeguard, iron-tail, synthesis, hidden-power, sunny-day, crunch, rock-smash, stockpile, spit-up, swallow, facade, nature-power, superpower, secret-power, tickle, sand-tomb, bullet-seed, mud-shot, magical-leaf, leaf-blade, natural-gift, worry-seed, seed-bomb, energy-ball, earth-power, zen-headbutt, rock-climb, leaf-storm, iron-head, captivate, stealth-rock, grass-knot, wide-guard, smack-down, heavy-slam, round, shell-smash, grass-pledge, bulldoze, work-up, grassy-terrain, confide, leafage, grassy-glide, tera-blast, trailblaze"
388,Grotle,Grass,NULL,Overgrow,NULL,Shell Armor,50,142,75,89,85,55,65,36,405,213.8 lbs.,"3'07""",Grove Pokémon,Monster,Grass,"swords-dance, cut, headbutt, tackle, body-slam, take-down, thrash, double-edge, bite, roar, strength, absorb, mega-drain, leech-seed, growth, razor-leaf, solar-beam, sleep-powder, toxic, double-team, withdraw, light-screen, reflect, amnesia, flash, rest, substitute, snore, curse, protect, mud-slap, giga-drain, endure, swagger, attract, sleep-talk, return, frustration, safeguard, iron-tail, synthesis, hidden-power, sunny-day, crunch, rock-smash, stockpile, spit-up, swallow, facade, nature-power, superpower, secret-power, tickle, sand-tomb, bullet-seed, mud-shot, magical-leaf, leaf-blade, natural-gift, worry-seed, seed-bomb, energy-ball, earth-power, zen-headbutt, rock-climb, leaf-storm, iron-head, captivate, stealth-rock, grass-knot, wide-guard, smack-down, heavy-slam, round, shell-smash, grass-pledge, bulldoze, work-up, grassy-terrain, confide, leafage, grassy-glide, tera-blast, trailblaze"
389,Torterra,Grass,Ground,Overgrow,NULL,Shell Armor,50,236,95,109,105,75,85,56,525,683.4 lbs.,"7'03""",Continent Pokémon,Monster,Grass,"swords-dance, cut, headbutt, tackle, body-slam, take-down, thrash, double-edge, bite, roar, hyper-beam, strength, absorb, mega-drain, leech-seed, growth, razor-leaf, solar-beam, sleep-powder, earthquake, toxic, double-team, withdraw, light-screen, reflect, amnesia, flash, rest, rock-slide, substitute, snore, curse, protect, scary-face, mud-slap, outrage, sandstorm, giga-drain, endure, swagger, attract, sleep-talk, return, frustration, safeguard, iron-tail, synthesis, hidden-power, sunny-day, crunch, rock-smash, stockpile, spit-up, swallow, facade, nature-power, superpower, secret-power, hyper-voice, rock-tomb, tickle, sand-tomb, bullet-seed, iron-defense, block, frenzy-plant, mud-shot, magical-leaf, leaf-blade, rock-blast, natural-gift, worry-seed, rock-polish, seed-bomb, energy-ball, earth-power, giga-impact, zen-headbutt, rock-climb, leaf-storm, iron-head, stone-edge, captivate, stealth-rock, grass-knot, wood-hammer, wide-guard, smack-down, heavy-slam, round, shell-smash, grass-pledge, bulldoze, work-up, grassy-terrain, confide, high-horsepower, leafage, stomping-tantrum, body-press, grassy-glide, scorching-sands, headlong-rush, tera-blast, trailblaze, hard-press"
390,Chimchar,Fire,NULL,Blaze,NULL,Iron Fist,50,62,44,58,44,58,44,61,309,13.7 lbs.,"1'08""",Chimp Pokémon,Field,Human-Like,"fire-punch, thunder-punch, scratch, swords-dance, cut, double-kick, headbutt, tackle, take-down, double-edge, leer, ember, flamethrower, submission, low-kick, counter, strength, fire-spin, dig, toxic, agility, double-team, focus-energy, metronome, fire-blast, swift, fury-swipes, rest, rock-slide, substitute, thief, flame-wheel, snore, protect, mud-slap, endure, rollout, swagger, attract, sleep-talk, return, frustration, encore, iron-tail, hidden-power, sunny-day, psych-up, rock-smash, fake-out, uproar, heat-wave, torment, will-o-wisp, facade, focus-punch, taunt, helping-hand, role-play, assist, brick-break, knock-off, endeavor, secret-power, blaze-kick, slack-off, fake-tears, overheat, rock-tomb, aerial-ace, bulk-up, covet, natural-gift, u-turn, fling, flare-blitz, poison-jab, vacuum-wave, switcheroo, nasty-plot, shadow-claw, zen-headbutt, rock-climb, gunk-shot, captivate, stealth-rock, grass-knot, hone-claws, flame-charge, low-sweep, round, quick-guard, incinerate, acrobatics, fire-pledge, work-up, confide, power-up-punch, burning-jealousy, tera-blast, temper-flare"
391,Monferno,Fire,Fighting,Blaze,NULL,Iron Fist,50,142,64,78,52,78,52,81,405,48.5 lbs.,"2'11""",Playful Pokémon,Field,Human-Like,"fire-punch, thunder-punch, scratch, swords-dance, cut, double-kick, headbutt, tackle, take-down, double-edge, leer, ember, flamethrower, low-kick, counter, strength, fire-spin, dig, toxic, agility, double-team, focus-energy, metronome, fire-blast, swift, fury-swipes, rest, rock-slide, substitute, thief, flame-wheel, snore, reversal, protect, mach-punch, mud-slap, endure, rollout, swagger, attract, sleep-talk, return, frustration, encore, iron-tail, hidden-power, sunny-day, psych-up, rock-smash, fake-out, uproar, heat-wave, torment, will-o-wisp, facade, focus-punch, taunt, helping-hand, role-play, brick-break, knock-off, endeavor, secret-power, slack-off, fake-tears, overheat, rock-tomb, aerial-ace, bulk-up, covet, natural-gift, feint, u-turn, close-combat, fling, flare-blitz, poison-jab, drain-punch, vacuum-wave, focus-blast, switcheroo, nasty-plot, shadow-claw, zen-headbutt, rock-climb, gunk-shot, captivate, stealth-rock, grass-knot, hone-claws, smack-down, flame-charge, low-sweep, round, incinerate, acrobatics, retaliate, fire-pledge, work-up, dual-chop, confide, power-up-punch, burning-jealousy, lash-out, tera-blast, temper-flare, upper-hand"
392,Infernape,Fire,Fighting,Blaze,NULL,Iron Fist,50,240,76,104,71,104,71,108,534,121.3 lbs.,"3'11""",Flame Pokémon,Field,Human-Like,"fire-punch, thunder-punch, scratch, swords-dance, cut, double-kick, headbutt, tackle, body-slam, take-down, double-edge, leer, roar, ember, flamethrower, hyper-beam, low-kick, counter, strength, solar-beam, fire-spin, earthquake, dig, toxic, agility, double-team, focus-energy, metronome, fire-blast, swift, fury-swipes, rest, rock-slide, substitute, thief, flame-wheel, snore, reversal, protect, mach-punch, scary-face, mud-slap, endure, rollout, swagger, attract, sleep-talk, return, frustration, encore, iron-tail, hidden-power, sunny-day, psych-up, rock-smash, fake-out, uproar, heat-wave, torment, will-o-wisp, facade, focus-punch, taunt, helping-hand, role-play, brick-break, knock-off, endeavor, secret-power, slack-off, blast-burn, fake-tears, overheat, rock-tomb, aerial-ace, bulk-up, covet, calm-mind, natural-gift, feint, u-turn, close-combat, fling, punishment, flare-blitz, aura-sphere, poison-jab, drain-punch, vacuum-wave, focus-blast, switcheroo, giga-impact, nasty-plot, shadow-claw, zen-headbutt, rock-climb, gunk-shot, stone-edge, captivate, stealth-rock, grass-knot, hone-claws, smack-down, flame-charge, low-sweep, round, incinerate, acrobatics, retaliate, fire-pledge, bulldoze, work-up, dual-chop, confide, power-up-punch, laser-focus, throat-chop, burning-jealousy, lash-out, coaching, scorching-sands, raging-fury, tera-blast, temper-flare, upper-hand"
